Ticker,Sector,CurrentPrice,Min52w,Max52w,DistanceFromMin,RSI,Estado,Classification,DataPoints,AnalysisDate
DJUSFR,Dow Jones U.S. Forestry & Paper Index,845.14,703.58,952.75,20.119957929446535,54.93058027767891,游리,CERCA,251,2025-08-14 07:46:33
DJUSAE,Dow Jones U.S. Aerospace & Defense Index,2723.2,1861.2,2775.1,46.31420588867396,49.713958810068654,游댮,FUERTE,251,2025-08-14 07:46:33
DJUSAF,Dow Jones U.S. Delivery Services Index,1023.9,916.9,1383.0,11.669756789180937,62.073220896750286,游리,CERCA,251,2025-08-14 07:46:33
DJUSAG,Dow Jones U.S. Asset Managers Index,416.51,273.77,419.77,52.138656536508755,45.509893455098954,游댮,FUERTE,251,2025-08-14 07:46:33
DJUSAI,Dow Jones U.S. Electronic Equipment Index,1572.4,913.78,1587.95,72.07642977521942,28.430580935786807,游댮,FUERTE,251,2025-08-14 07:46:33
DJUSAL,Dow Jones U.S. Aluminum Index,108.39,73.62,163.19,47.22901385493072,50.76504590275416,游댮,FUERTE,251,2025-08-14 07:46:33
DJUSAM,Dow Jones U.S. Medical Equipment Index,2979.0,2589.3,3151.1,15.05039972193256,46.78526048284623,游리,CERCA,251,2025-08-14 07:46:33
DJUSAP,Dow Jones U.S. Automobiles & Parts Index,1296.85,829.29,1748.7,56.38075944482629,29.300156628221558,游댮,FUERTE,251,2025-08-14 07:46:33
DJUSAR,Dow Jones U.S. Airlines Index,230.98,133.85,259.72,72.56630556593201,36.63713547434478,游댮,FUERTE,251,2025-08-14 07:46:33
DJUSAS,Dow Jones U.S. Aerospace Index,2931.9,1883.9,3039.2,55.62927968575826,55.83953413134904,游댮,FUERTE,251,2025-08-14 07:46:33
DJUSAT,Dow Jones U.S. Auto Parts Index,417.67,288.25,418.83,44.89852558542932,32.482561826252365,游댮,FUERTE,251,2025-08-14 07:46:33
DJUSAU,Dow Jones U.S. Automobiles Index,1170.15,724.85,1613.6,61.43340001379597,29.545022615834867,游댮,FUERTE,251,2025-08-14 07:46:33
DJUSAV,Dow Jones U.S. Media Agencies Index,441.44,346.44,702.93,27.421775776469232,73.1545351590652,游댮,FUERTE,251,2025-08-14 07:46:33
DJUSBC,Dow Jones U.S. Broadcasting & Entertainment Index,1196.1,962.0,1294.9,24.334719334719328,67.83831282952552,游리,CERCA,251,2025-08-14 07:46:33
DJUSBD,Dow Jones U.S. Building Materials & Fixtures Index,2502.4,1876.9,2557.1,33.32622942085353,43.28729281767956,游댮,FUERTE,251,2025-08-14 07:46:33
DJUSBE,Dow Jones U.S. Business Training & Employment Agencies Index,108.18,104.12,152.72,3.8993469074145235,72.99488054607505,游릭,OPORTUNIDAD,251,2025-08-14 07:46:33
DJUSBK,Dow Jones U.S. Banks Index,735.35,521.55,761.58,40.9931933659285,60.14105335001701,游댮,FUERTE,251,2025-08-14 07:46:33
DJUSBS,Dow Jones U.S. Basic Resources Index,409.27,274.91,409.9,48.874177003382904,38.817275747508326,游댮,FUERTE,251,2025-08-14 07:46:33
DJUSBT,Dow Jones U.S. Biotechnology Index,2734.2,2297.4,3119.9,19.012797074954282,45.942373777425345,游리,CERCA,251,2025-08-14 07:46:33
DJUSBV,Dow Jones U.S. Beverages Index,976.89,875.4,1070.16,11.593557230980124,38.76072291163484,游리,CERCA,251,2025-08-14 07:46:33
DJUSCA,Dow Jones U.S. Gambling Index,735.4,513.6,765.64,43.1853582554517,54.552942938445405,游댮,FUERTE,251,2025-08-14 07:46:33
DJUSCC,Dow Jones U.S. Commodity Chemicals Index,742.52,647.09,855.73,14.74756216291396,52.42827868852459,游리,CERCA,251,2025-08-14 07:46:33
DJUSCH,Dow Jones U.S. Chemicals Index,1988.64,1497.87,2050.51,32.76452562638949,51.31861912846633,游댮,FUERTE,251,2025-08-14 07:46:33
DJUSCM,Dow Jones U.S. Personal Products Index,445.13,345.1,483.97,28.98580121703853,47.05491291051721,游댮,FUERTE,251,2025-08-14 07:46:33
DJUSCN,Dow Jones U.S. Construction & Materials Index,2084.71,1484.39,2096.84,40.44220184722343,43.343998274436494,游댮,FUERTE,251,2025-08-14 07:46:33
DJUSCP,Dow Jones U.S. Containers & Packaging Index,463.21,397.01,541.01,16.67464295609682,65.30664286625019,游리,CERCA,251,2025-08-14 07:46:33
DJUSCR,Dow Jones U.S. Computer Hardware Index,11674.4,8364.8,12829.5,39.56579954093344,30.03548676728377,游댮,FUERTE,251,2025-08-14 07:46:33
DJUSCS,Dow Jones U.S. Specialized Consumer Services Index,2803.5,2625.1,3402.3,6.795931583558726,45.00965872504829,游릭,OPORTUNIDAD,251,2025-08-14 07:46:33
DJUSCT,Dow Jones U.S. Telecommunications Equipment Index,2547.51,1708.47,2589.69,49.11060773674693,28.886946511181733,游댮,FUERTE,251,2025-08-14 07:46:33
DJUSCX,Dow Jones U.S. Specialty Chemicals Index,1094.78,863.05,1218.81,26.850124558252713,56.62031085660865,游댮,FUERTE,251,2025-08-14 07:46:33
DJUSDB,Dow Jones U.S. Brewers Index,527.89,479.19,659.78,10.162983367766437,45.95130237825593,游리,CERCA,251,2025-08-14 07:46:33
DJUSDN,Dow Jones U.S. Defense Index,768.0,598.11,788.84,28.40447409339419,32.2805952019435,游댮,FUERTE,251,2025-08-14 07:46:33
DJUSDR,Dow Jones U.S. Food & Drug Retailers Index,1564.7,1221.74,1615.62,28.071439095061145,61.94625998547575,游댮,FUERTE,251,2025-08-14 07:46:33
DJUSDS,Dow Jones U.S. Industrial Suppliers Index,967.51,683.22,967.7,41.610315857264126,40.19134556306502,游댮,FUERTE,251,2025-08-14 07:46:33
DJUSDT,Dow Jones U.S. Diversified REITs Index,56.51,45.49,57.29,24.22510441855352,41.826215022091304,游리,CERCA,251,2025-08-14 07:46:33
DJUSDV,Dow Jones U.S. Computer Services Index,246.14,228.45,304.29,7.7434887283869545,75.66494640730453,游릭,OPORTUNIDAD,251,2025-08-14 07:46:33
DJUSEC,Dow Jones U.S. Electrical Components & Equipment Index,1003.26,562.61,1055.56,78.32246138532909,51.87106335679881,游댮,FUERTE,251,2025-08-14 07:46:33
DJUSEE,Dow Jones U.S. Electronic & Electrical Equipment Index,1135.94,643.85,1171.37,76.42929253708162,43.701057837615046,游댮,FUERTE,251,2025-08-14 07:46:33
DJUSEH,Dow Jones U.S. Real Estate Holding & Development Index,61.67,50.8,72.61,21.3976377952756,32.50414593698177,游리,CERCA,251,2025-08-14 07:46:33
DJUSEN,Dow Jones U.S. Oil & Gas Index,720.23,623.85,813.7,15.449226576901498,59.30000000000001,游리,CERCA,251,2025-08-14 07:46:33
DJUSES,Dow Jones U.S. Real Estate Services Index,372.1,268.15,381.33,38.76561625955624,36.004390779363355,游댮,FUERTE,251,2025-08-14 07:46:33
DJUSEU,Dow Jones U.S. Electricity Index,425.43,340.99,433.59,24.76318953635004,37.78920308483289,游리,CERCA,251,2025-08-14 07:46:33
DJUSFA,Dow Jones U.S. Financial Administration Index,588.45,532.41,685.16,10.525722657350553,61.42640717865043,游리,CERCA,251,2025-08-14 07:46:33
DJUSFB,Dow Jones U.S. Food & Beverage Index,723.63,668.77,816.7,8.20311915905319,45.80850218514099,游릭,OPORTUNIDAD,251,2025-08-14 07:46:33
DJUSFC,Dow Jones U.S. Fixed Line Telecommunications Index,168.03,112.81,172.38,48.949561209112666,40.93567251461992,游댮,FUERTE,251,2025-08-14 07:46:33
DJUSFD,Dow Jones U.S. Food Retailers & Wholesalers Index,1297.59,1012.93,1346.72,28.102632955880463,61.2689044632978,游댮,FUERTE,251,2025-08-14 07:46:33
DJUSFE,Dow Jones U.S. Industrial Machinery Index,1268.31,969.18,1325.15,30.864235745681917,41.96831270961027,游댮,FUERTE,251,2025-08-14 07:46:33
DJUSFH,Dow Jones U.S. Furnishings Index,469.73,319.67,470.64,46.942159101573495,22.817925856405438,游댮,FUERTE,251,2025-08-14 07:46:33
DJUSFI,Dow Jones U.S. Financial Services Index,2465.8,1895.9,2486.0,30.059602299699357,48.9601386481802,游댮,FUERTE,251,2025-08-14 07:46:33
DJUSFO,Dow Jones U.S. Food Producers Index,383.11,367.79,460.77,4.165420484515618,63.92969569779644,游릭,OPORTUNIDAD,251,2025-08-14 07:46:33
DJUSFP,Dow Jones U.S. Food Products Index,541.17,528.55,667.01,2.387664364771546,68.68567572127567,游릭,OPORTUNIDAD,251,2025-08-14 07:46:33
DJUSFT,Dow Jones U.S. Footwear Index,1631.9,1186.7,2012.4,37.515800117974216,48.060150375939834,游댮,FUERTE,251,2025-08-14 07:46:33
DJUSGF,Dow Jones U.S. Financial Services Index,2763.8,2125.0,2786.5,30.06117647058824,48.97406116918309,游댮,FUERTE,251,2025-08-14 07:46:33
DJUSGI,Dow Jones U.S. General Industrials Index,743.54,613.23,783.86,21.249775777440753,56.10526315789479,游리,CERCA,251,2025-08-14 07:46:33
DJUSGT,Dow Jones U.S. General Retailers Index,3523.3,2702.7,3560.4,30.36223036223038,42.41200230813614,游댮,FUERTE,251,2025-08-14 07:46:33
DJUSGU,Dow Jones U.S. Gas Distribution Index,377.73,293.54,377.74,28.680929345234034,30.56603773584908,游댮,FUERTE,251,2025-08-14 07:46:33
DJUSHB,Dow Jones U.S. Home Construction Index,2674.2,1872.38,3170.03,42.82357213813434,21.72739286388523,游댮,FUERTE,251,2025-08-14 07:46:33
DJUSHC,Dow Jones U.S. Health Care Index,1418.6,1344.15,1663.54,5.538816352341615,54.87798190293396,游릭,OPORTUNIDAD,251,2025-08-14 07:46:33
DJUSHD,Dow Jones U.S. Durable Household Products Index,140.22,94.51,179.28,48.36525235424822,57.880434782608695,游댮,FUERTE,251,2025-08-14 07:46:33
DJUSHG,Dow Jones U.S. Household Goods & Home Construction Index,1076.73,999.49,1229.25,7.727941250037521,43.137992662966845,游릭,OPORTUNIDAD,251,2025-08-14 07:46:33
DJUSHI,Dow Jones U.S. Home Improvement Retailers Index,894.33,705.04,958.3,26.848122092363568,18.09208103130753,游댮,FUERTE,251,2025-08-14 07:46:33
DJUSHL,Dow Jones U.S. Hotel & Lodging REITs Index,85.67,65.02,103.03,31.75945862811444,56.245538900785135,游댮,FUERTE,251,2025-08-14 07:46:33
DJUSHN,Dow Jones U.S. Nondurable Household Products Index,1223.87,1180.41,1421.48,3.681771587838108,60.2741020793951,游릭,OPORTUNIDAD,251,2025-08-14 07:46:33
DJUSHP,Dow Jones U.S. Health Care Providers Index,2318.7,2106.6,3545.2,10.068356593563085,42.34924376350424,游리,CERCA,251,2025-08-14 07:46:33
DJUSHR,Dow Jones U.S. Commercial Vehicles & Trucks Index,5414.4,3916.0,5506.5,38.26353421859039,51.60469390640469,游댮,FUERTE,251,2025-08-14 07:46:33
DJUSHV,Dow Jones U.S. Heavy Construction Index,1989.78,1138.85,2114.89,74.71835623655443,46.76824424015436,游댮,FUERTE,251,2025-08-14 07:46:33
DJUSIB,Dow Jones U.S. Insurance Brokers Index,774.2,729.23,891.38,6.166778656939515,49.67361740707161,游릭,OPORTUNIDAD,251,2025-08-14 07:46:33
DJUSID,Dow Jones U.S. Diversified Industrials Index,957.32,767.22,1017.95,24.777769088397072,44.88053135512809,游리,CERCA,251,2025-08-14 07:46:33
DJUSIG,Dow Jones U.S. Industrial Goods & Services Index,1461.84,1094.74,1484.13,33.53307634689514,52.5123391860183,游댮,FUERTE,251,2025-08-14 07:46:33
DJUSIL,Dow Jones U.S. Life Insurance Index,1243.46,1077.94,1380.29,15.355214575950422,46.95106544260085,游리,CERCA,251,2025-08-14 07:46:33
DJUSIM,Dow Jones U.S. Industrial Metals & Mining Index,508.49,350.58,568.14,45.04250099834561,51.82686902754356,游댮,FUERTE,251,2025-08-14 07:46:33
DJUSIO,Dow Jones U.S. Industrial & Office REITs Index,96.51,79.12,119.27,21.97927199191102,58.20642978003381,游리,CERCA,251,2025-08-14 07:46:33
DJUSIP,Dow Jones U.S. Property & Casualty Insurance Index,1944.98,1747.65,2065.57,11.291162418104307,37.630322969278495,游리,CERCA,251,2025-08-14 07:46:33
DJUSIQ,Dow Jones U.S. Industrial Engineering Index,4455.7,3318.0,4522.4,34.28872814948763,46.495119787045255,游댮,FUERTE,251,2025-08-14 07:46:33
DJUSIR,Dow Jones U.S. Insurance Index,1348.8,1243.87,1458.0,8.435769011231082,42.76303523708906,游릭,OPORTUNIDAD,251,2025-08-14 07:46:33
DJUSIS,Dow Jones U.S. Support Services Index,873.95,764.29,981.89,14.347956927344343,60.159707523571285,游리,CERCA,251,2025-08-14 07:46:33
DJUSIT,Dow Jones U.S. Industrial Transportation Index,1452.5,1243.5,1746.8,16.807398472054686,55.461507456670695,游리,CERCA,251,2025-08-14 07:46:33
DJUSIU,Dow Jones U.S. Reinsurance Index,514.65,467.58,599.38,10.06672654946747,48.21980384253662,游리,CERCA,251,2025-08-14 07:46:33
DJUSIV,Dow Jones U.S. Business Support Services Index,1179.87,1092.82,1443.42,7.965630204425245,65.28958630527822,游릭,OPORTUNIDAD,251,2025-08-14 07:46:33
DJUSIX,Dow Jones U.S. Nonlife Insurance Index,1342.27,1237.11,1458.15,8.500456709589292,41.53389888957864,游릭,OPORTUNIDAD,251,2025-08-14 07:46:33
DJUSLE,Dow Jones U.S. Leisure Goods Index,1150.33,724.03,1171.82,58.87877574133669,33.833892926982244,游댮,FUERTE,251,2025-08-14 07:46:33
DJUSLG,Dow Jones U.S. Hotels Index,4309.1,3245.4,4663.6,32.775620878782284,48.94061890158902,游댮,FUERTE,251,2025-08-14 07:46:33
DJUSMC,Dow Jones U.S. Health Care Equipment & Services Index,2189.9,2083.0,2559.1,5.1320211233797455,45.833333333333336,游릭,OPORTUNIDAD,251,2025-08-14 07:46:33
DJUSME,Dow Jones U.S. Media Index,826.82,662.35,936.97,24.831282554540653,69.39171319424035,游리,CERCA,251,2025-08-14 07:46:33
DJUSMF,Dow Jones U.S. Mortgage Finance Index,12.92,9.98,12.93,29.45891783567134,18.828451882845158,游댮,FUERTE,251,2025-08-14 07:46:33
DJUSMG,Dow Jones U.S. Mining Index,158.22,84.25,162.09,87.79821958456974,29.507351044622112,游댮,FUERTE,251,2025-08-14 07:46:33
DJUSMR,Dow Jones U.S. Mortgage REITs Index,30.87,24.64,32.23,25.28409090909091,45.329670329670336,游댮,FUERTE,251,2025-08-14 07:46:33
DJUSMS,Dow Jones U.S. Medical Supplies Index,1569.1,1469.4,1749.93,6.785082346535988,71.20819449586577,游릭,OPORTUNIDAD,251,2025-08-14 07:46:33
DJUSMT,Dow Jones U.S. Marine Transportation Index,326.61,275.54,433.97,18.534514045147706,68.55928135500241,游리,CERCA,251,2025-08-14 07:46:33
DJUSMU,Dow Jones U.S. Multiutilities Index,289.39,249.55,292.91,15.964736525746332,39.896873992910116,游리,CERCA,251,2025-08-14 07:46:33
DJUSNF,Dow Jones U.S. Nonferrous Metals Index,571.73,372.55,702.28,53.463964568514285,57.65283910690964,游댮,FUERTE,251,2025-08-14 07:46:33
DJUSNG,Dow Jones U.S. Personal & Household Goods Index,1069.46,909.61,1071.78,17.573465551170283,30.336189848385004,游리,CERCA,251,2025-08-14 07:46:33
DJUSNS,Dow Jones U.S. Internet Index,5793.4,3842.4,5866.6,50.775556943576916,31.6271963330787,游댮,FUERTE,251,2025-08-14 07:46:33
DJUSOG,Dow Jones U.S. Oil & Gas Producers,819.1,707.01,914.32,15.854089758277823,56.966860853786656,游리,CERCA,251,2025-08-14 07:46:33
DJUSOI,Dow Jones U.S. Oil Equipment & Services Index,238.7,198.86,294.15,20.034194910992646,67.16711789318244,游리,CERCA,251,2025-08-14 07:46:33
DJUSOL,Dow Jones U.S. Integrated Oil & Gas Index,727.69,645.42,807.01,12.746738557838322,57.327839905826906,游리,CERCA,251,2025-08-14 07:46:33
DJUSOS,Dow Jones U.S. Exploration & Production Index,989.82,821.29,1123.35,20.520157313494636,56.155720966998196,游리,CERCA,251,2025-08-14 07:46:33
DJUSPB,Dow Jones U.S. Publishing Index,857.34,663.16,874.35,29.28101815549793,35.07221646657325,游댮,FUERTE,251,2025-08-14 07:46:33
DJUSPC,Dow Jones U.S. Waste & Disposal Services Index,687.12,609.51,708.03,12.733179111089237,51.225359616409186,游리,CERCA,251,2025-08-14 07:46:33
DJUSPG,Sector PG,559.98,426.49,649.12,31.299678773242047,48.75125789040343,游댮,FUERTE,251,2025-08-14 07:46:33
DJUSPL,Dow Jones U.S. Pipelines Index,1028.36,860.8,1229.95,19.465613382899623,58.50726798360043,游리,CERCA,251,2025-08-14 07:46:33
DJUSPM,Dow Jones U.S. Gold Mining Index,178.12,94.85,182.48,87.79124934106486,29.488649392341216,游댮,FUERTE,251,2025-08-14 07:46:33
DJUSPN,Dow Jones U.S. Pharmaceuticals & Biotechnology Index,1083.01,960.01,1277.87,12.812366537848563,59.27877783041212,游리,CERCA,251,2025-08-14 07:46:33
DJUSPR,Dow Jones U.S. Pharmaceuticals Index,819.78,765.56,1006.37,7.082397199435711,67.27991037207383,游릭,OPORTUNIDAD,251,2025-08-14 07:46:33
DJUSRA,Dow Jones U.S. Apparel Retailers Index,1794.1,1490.78,1826.93,20.34639584646963,23.518801165533546,游리,CERCA,251,2025-08-14 07:46:33
DJUSRB,Dow Jones U.S. Broadline Retailers Index,4786.5,3641.4,5034.6,31.44669632558906,52.469494479953525,游댮,FUERTE,251,2025-08-14 07:46:33
DJUSRD,Dow Jones U.S. Drug Retailers Index,1131.48,838.78,1209.83,34.895920265147005,56.268856026509695,游댮,FUERTE,251,2025-08-14 07:46:33
DJUSRE,Dow Jones U.S. Real Estate Index,362.69,311.91,396.67,16.280337276778546,60.93564473996672,游리,CERCA,251,2025-08-14 07:46:33
DJUSRH,Dow Jones U.S. Real Estate Investment & Services,779.04,563.1,797.37,38.34842834310068,35.68592853992065,游댮,FUERTE,251,2025-08-14 07:46:33
DJUSRI,Dow Jones U.S. Real Estate Investment Trusts Index,145.35,126.8,162.95,14.629337539432175,63.59906213364593,游리,CERCA,251,2025-08-14 07:46:33
DJUSRL,Dow Jones U.S. Retail REITs Index,98.6,83.32,106.75,18.33893422947672,45.18997574777688,游리,CERCA,251,2025-08-14 07:46:33
DJUSRN,Dow Jones U.S. Residential REITs Index,224.88,212.75,271.87,5.7015276145710905,63.5597548518897,游릭,OPORTUNIDAD,251,2025-08-14 07:46:33
DJUSRP,Dow Jones U.S. Recreational Products Index,402.4,305.34,496.77,31.787515556428904,38.37441705529647,游댮,FUERTE,251,2025-08-14 07:46:33
DJUSRQ,Dow Jones U.S. Recreational Services Index,195.25,105.81,208.22,84.52887250732445,61.59301691216583,游댮,FUERTE,251,2025-08-14 07:46:33
DJUSRR,Dow Jones U.S. Railroads Index,3395.0,2788.9,3607.9,21.732582738714186,44.09287035134581,游리,CERCA,251,2025-08-14 07:46:33
DJUSRS,Dow Jones U.S. Specialty Retailers Index,4700.7,3017.5,4884.3,55.781275890637936,35.138954309938896,游댮,FUERTE,251,2025-08-14 07:46:33
DJUSRT,Dow Jones U.S. Retail Index,3159.8,2427.2,3175.9,30.182926829268308,42.832289491997166,游댮,FUERTE,251,2025-08-14 07:46:33
DJUSRU,Dow Jones U.S. Restaurants & Bars Index,3083.6,2686.2,3265.8,14.794132975951163,45.33520862634789,游리,CERCA,251,2025-08-14 07:46:33
DJUSSB,Dow Jones U.S. Investment Services Index,3011.7,2060.8,3053.4,46.142274844720475,46.96202531645573,游댮,FUERTE,251,2025-08-14 07:46:33
DJUSSC,Dow Jones U.S. Semiconductors Index,25722.7,12938.1,26004.7,98.81358159235127,34.18956786785306,游댮,FUERTE,251,2025-08-14 07:46:33
DJUSSD,Dow Jones U.S. Soft Drinks Index,946.09,835.84,1016.29,13.190323506891271,37.58817030679014,游리,CERCA,251,2025-08-14 07:46:33
DJUSSF,Dow Jones U.S. Consumer Finance Index,778.01,580.92,801.93,33.92721889416788,50.362544023202844,游댮,FUERTE,251,2025-08-14 07:46:33
DJUSSP,Dow Jones U.S. Specialty Finance Index,719.52,640.21,803.35,12.38812264725636,53.96013218207018,游리,CERCA,251,2025-08-14 07:46:33
DJUSSR,Dow Jones U.S. Specialty REITs Index,260.71,229.18,287.27,13.757745003927033,69.2175703500344,游리,CERCA,251,2025-08-14 07:46:33
DJUSST,Dow Jones U.S. Iron & Steel Index,589.79,416.26,642.02,41.687887378081,45.00216356555604,游댮,FUERTE,251,2025-08-14 07:46:33
DJUSSV,Dow Jones U.S. Software & Computer Services Index,8102.4,5509.7,8349.7,47.05700854855981,43.618396749168845,游댮,FUERTE,251,2025-08-14 07:46:33
DJUSSW,Dow Jones U.S. Software Index,8495.0,5758.2,8972.9,47.52874162064534,51.03337125521422,游댮,FUERTE,251,2025-08-14 07:46:33
DJUSTB,Dow Jones U.S. Tobacco Index,1141.14,824.94,1210.02,38.33006036802677,32.359300268623414,游댮,FUERTE,251,2025-08-14 07:46:33
DJUSTC,Dow Jones U.S. Technology Index,8106.3,5115.5,8176.9,58.46544814778615,33.47022587268994,游댮,FUERTE,251,2025-08-14 07:46:33
DJUSTK,Dow Jones U.S. Trucking Index,1434.19,1244.48,2071.67,15.244118025199283,59.390654115141686,游리,CERCA,251,2025-08-14 07:46:33
DJUSTL,Dow Jones U.S. Telecommunications Index,190.91,149.46,199.75,27.733172755252234,40.20408163265311,游댮,FUERTE,251,2025-08-14 07:46:33
DJUSTQ,Dow Jones U.S. Technology Hardware & Equipment Index,9095.0,5326.7,9145.4,70.74361236788256,31.121437845964593,游댮,FUERTE,251,2025-08-14 07:46:33
DJUSTR,Dow Jones U.S. Tires Index,9095.0,5326.7,9145.4,70.74361236788256,31.121437845964593,游댮,FUERTE,251,2025-08-14 07:46:33
DJUSTT,Dow Jones U.S. Travel & Tourism Index,1341.87,957.74,1425.35,40.1079624950404,61.26456763891571,游댮,FUERTE,251,2025-08-14 07:46:33
DJUSTY,Dow Jones U.S. Toys Index,1878.17,1079.51,1934.76,73.9835666181879,34.81918094185545,游댮,FUERTE,251,2025-08-14 07:46:33
DJUSUT,Dow Jones U.S. Utilities Index,429.77,353.79,435.98,21.476016846151662,37.511916110581545,游리,CERCA,251,2025-08-14 07:46:33
DJUSVE,Dow Jones U.S. Conventional Electricity Index,426.71,341.92,434.77,24.798198408984547,37.57009345794396,游리,CERCA,251,2025-08-14 07:46:33
DJUSVN,Dow Jones U.S. Distillers & Vintners Index,339.01,309.98,523.8,9.365120330343883,57.32609768130244,游릭,OPORTUNIDAD,251,2025-08-14 07:46:33
DJUSWC,Dow Jones U.S. Mobile Telecommunications Index,423.44,360.57,458.56,17.436281443270378,42.35142118863045,游리,CERCA,251,2025-08-14 07:46:33
DJUSWU,Dow Jones U.S. Water Index,2924.4,2432.7,3135.8,20.21211000123321,41.284038958457536,游리,CERCA,251,2025-08-14 07:46:33
