Ticker,Sector,CurrentPrice,Min52w,Max52w,DistanceFromMin,RSI,Estado,Classification,DataPoints,AnalysisDate
DJUSFR,Dow Jones U.S. Forestry & Paper Index,840.07,703.58,952.75,19.39935757127832,55.45803620405919,游리,CERCA,251,2025-09-10 07:42:56
DJUSAE,Dow Jones U.S. Aerospace & Defense Index,2706.6,1861.2,2775.1,45.422308188265625,44.68546637744039,游댮,FUERTE,251,2025-09-10 07:42:56
DJUSAF,Dow Jones U.S. Delivery Services Index,998.9,916.9,1383.0,8.943178100119969,61.45069274653628,游릭,OPORTUNIDAD,251,2025-09-10 07:42:56
DJUSAG,Dow Jones U.S. Asset Managers Index,403.2,273.77,419.77,47.27691127588853,49.19821826280627,游댮,FUERTE,251,2025-09-10 07:42:56
DJUSAI,Dow Jones U.S. Electronic Equipment Index,1611.18,913.78,1616.35,76.32033968788987,29.076669825909136,游댮,FUERTE,251,2025-09-10 07:42:56
DJUSAL,Dow Jones U.S. Aluminum Index,106.82,73.62,163.19,45.09644118446073,39.560912613000454,游댮,FUERTE,251,2025-09-10 07:42:56
DJUSAM,Dow Jones U.S. Medical Equipment Index,3018.6,2589.3,3151.1,16.579770594369123,44.544509871839296,游리,CERCA,251,2025-09-10 07:42:56
DJUSAP,Dow Jones U.S. Automobiles & Parts Index,1329.21,845.49,1748.7,57.21179434410816,39.68074492850017,游댮,FUERTE,251,2025-09-10 07:42:56
DJUSAR,Dow Jones U.S. Airlines Index,232.79,137.83,259.72,68.89646666182976,48.905109489051114,游댮,FUERTE,251,2025-09-10 07:42:56
DJUSAS,Dow Jones U.S. Aerospace Index,2907.9,1883.9,3039.2,54.3553267158554,43.6189121933878,游댮,FUERTE,251,2025-09-10 07:42:56
DJUSAT,Dow Jones U.S. Auto Parts Index,438.27,288.25,442.29,52.04509973980919,33.25057295645534,游댮,FUERTE,251,2025-09-10 07:42:56
DJUSAU,Dow Jones U.S. Automobiles Index,1197.56,758.25,1613.6,57.937355753379485,40.024748099699515,游댮,FUERTE,251,2025-09-10 07:42:56
DJUSAV,Dow Jones U.S. Media Agencies Index,441.31,346.44,702.93,27.384251241196168,46.410162002945526,游댮,FUERTE,251,2025-09-10 07:42:56
DJUSBC,Dow Jones U.S. Broadcasting & Entertainment Index,1215.4,962.0,1294.9,26.34095634095635,43.07992202729047,游댮,FUERTE,251,2025-09-10 07:42:56
DJUSBD,Dow Jones U.S. Building Materials & Fixtures Index,2436.5,1876.9,2557.1,29.815120677713242,55.18259935553168,游댮,FUERTE,251,2025-09-10 07:42:56
DJUSBE,Dow Jones U.S. Business Training & Employment Agencies Index,114.67,104.12,152.72,10.13253937764118,52.45460659045058,游리,CERCA,251,2025-09-10 07:42:56
DJUSBK,Dow Jones U.S. Banks Index,761.91,521.55,777.15,46.085706068449824,35.04471679364032,游댮,FUERTE,251,2025-09-10 07:42:56
DJUSBS,Dow Jones U.S. Basic Resources Index,427.48,274.91,440.12,55.49816303517514,21.642842762230785,游댮,FUERTE,251,2025-09-10 07:42:56
DJUSBT,Dow Jones U.S. Biotechnology Index,2770.6,2297.4,3117.3,20.597196831200478,50.18501387604075,游리,CERCA,251,2025-09-10 07:42:56
DJUSBV,Dow Jones U.S. Beverages Index,924.68,875.4,1065.32,5.62942654786383,78.72919818456889,游릭,OPORTUNIDAD,251,2025-09-10 07:42:56
DJUSCA,Dow Jones U.S. Gambling Index,742.04,513.6,786.57,44.47819314641743,47.5911751463305,游댮,FUERTE,251,2025-09-10 07:42:56
DJUSCC,Dow Jones U.S. Commodity Chemicals Index,740.52,647.09,855.73,14.438486145667518,55.58674901740597,游리,CERCA,251,2025-09-10 07:42:56
DJUSCH,Dow Jones U.S. Chemicals Index,2004.15,1497.87,2050.51,33.799995994311935,51.08405292911722,游댮,FUERTE,251,2025-09-10 07:42:56
DJUSCM,Dow Jones U.S. Personal Products Index,406.04,345.1,483.97,17.658649666763253,69.4697833523375,游리,CERCA,251,2025-09-10 07:42:56
DJUSCN,Dow Jones U.S. Construction & Materials Index,2036.06,1484.39,2096.84,37.16476128241229,54.497334634732354,游댮,FUERTE,251,2025-09-10 07:42:56
DJUSCP,Dow Jones U.S. Containers & Packaging Index,440.56,397.01,541.01,10.969496990000255,53.03005419609131,游리,CERCA,251,2025-09-10 07:42:56
DJUSCR,Dow Jones U.S. Computer Hardware Index,11795.5,8364.8,12829.5,41.013532899770475,42.026187171906145,游댮,FUERTE,251,2025-09-10 07:42:56
DJUSCS,Dow Jones U.S. Specialized Consumer Services Index,2743.1,2625.1,3402.3,4.495066854596016,65.91569767441868,游릭,OPORTUNIDAD,251,2025-09-10 07:42:56
DJUSCT,Dow Jones U.S. Telecommunications Equipment Index,2545.05,1708.47,2589.69,48.96661925582539,27.43948145861806,游댮,FUERTE,251,2025-09-10 07:42:56
DJUSCX,Dow Jones U.S. Specialty Chemicals Index,1084.13,863.05,1218.81,25.616128845373982,55.169746454662665,游댮,FUERTE,251,2025-09-10 07:42:56
DJUSDB,Dow Jones U.S. Brewers Index,504.82,479.19,659.78,5.348609111208496,62.532148702361454,游릭,OPORTUNIDAD,251,2025-09-10 07:42:56
DJUSDN,Dow Jones U.S. Defense Index,767.05,598.11,788.84,28.245640434033863,49.03697996918336,游댮,FUERTE,251,2025-09-10 07:42:56
DJUSDR,Dow Jones U.S. Food & Drug Retailers Index,1565.29,1221.74,1615.62,28.119730875636385,48.456714716182105,游댮,FUERTE,251,2025-09-10 07:42:56
DJUSDS,Dow Jones U.S. Industrial Suppliers Index,958.45,683.22,994.97,40.28424226457071,52.403001756346804,游댮,FUERTE,251,2025-09-10 07:42:56
DJUSDT,Dow Jones U.S. Diversified REITs Index,58.25,45.49,58.7,28.050120905693554,35.6707317073171,游댮,FUERTE,251,2025-09-10 07:42:56
DJUSDV,Dow Jones U.S. Computer Services Index,261.03,231.08,304.29,12.960879349143136,27.143821742066194,游리,CERCA,251,2025-09-10 07:42:56
DJUSEC,Dow Jones U.S. Electrical Components & Equipment Index,982.69,562.61,1055.56,74.66628748155917,46.83340339078041,游댮,FUERTE,251,2025-09-10 07:42:56
DJUSEE,Dow Jones U.S. Electronic & Electrical Equipment Index,1128.27,643.85,1171.37,75.23802127824804,41.491981100685436,游댮,FUERTE,251,2025-09-10 07:42:56
DJUSEH,Dow Jones U.S. Real Estate Holding & Development Index,64.63,50.8,72.61,27.224409448818896,35.8318098720293,游댮,FUERTE,251,2025-09-10 07:42:56
DJUSEN,Dow Jones U.S. Oil & Gas Index,733.7,623.85,813.7,17.608399454997198,38.09255079006765,游리,CERCA,251,2025-09-10 07:42:56
DJUSES,Dow Jones U.S. Real Estate Services Index,378.32,268.15,387.38,41.08521349990678,45.458175284487915,游댮,FUERTE,251,2025-09-10 07:42:56
DJUSEU,Dow Jones U.S. Electricity Index,408.81,340.99,433.59,19.88914630927593,75.4834254143646,游리,CERCA,251,2025-09-10 07:42:56
DJUSFA,Dow Jones U.S. Financial Administration Index,578.92,532.41,685.16,8.735748765049491,55.800000000000054,游릭,OPORTUNIDAD,251,2025-09-10 07:42:56
DJUSFB,Dow Jones U.S. Food & Beverage Index,697.82,668.77,816.7,4.343795325747277,72.23684210526307,游릭,OPORTUNIDAD,251,2025-09-10 07:42:56
DJUSFC,Dow Jones U.S. Fixed Line Telecommunications Index,173.87,125.98,175.95,38.01397047150341,44.82477587612065,游댮,FUERTE,251,2025-09-10 07:42:56
DJUSFD,Dow Jones U.S. Food Retailers & Wholesalers Index,1281.38,1012.93,1346.72,26.502324938544636,52.265135699373644,游댮,FUERTE,251,2025-09-10 07:42:56
DJUSFE,Dow Jones U.S. Industrial Machinery Index,1245.27,969.18,1325.15,28.486968365009602,50.41432942376337,游댮,FUERTE,251,2025-09-10 07:42:56
DJUSFH,Dow Jones U.S. Furnishings Index,486.63,319.67,507.6,52.228861012919566,37.94664125774178,游댮,FUERTE,251,2025-09-10 07:42:56
DJUSFI,Dow Jones U.S. Financial Services Index,2476.6,1907.9,2510.3,29.807641909953343,42.59433962264144,游댮,FUERTE,251,2025-09-10 07:42:56
DJUSFO,Dow Jones U.S. Food Producers Index,382.62,367.79,460.77,4.032192283640116,48.27978390673872,游릭,OPORTUNIDAD,251,2025-09-10 07:42:56
DJUSFP,Dow Jones U.S. Food Products Index,538.07,524.18,667.01,2.649853103895628,51.59301130524148,游릭,OPORTUNIDAD,251,2025-09-10 07:42:56
DJUSFT,Dow Jones U.S. Footwear Index,1593.0,1186.7,2012.4,34.237802308923904,57.80943025540275,游댮,FUERTE,251,2025-09-10 07:42:56
DJUSGF,Dow Jones U.S. Financial Services Index,2776.0,2138.5,2813.7,29.810614916997896,42.592592592592645,游댮,FUERTE,251,2025-09-10 07:42:56
DJUSGI,Dow Jones U.S. General Industrials Index,714.36,613.23,783.86,16.49136539308253,54.576902607770094,游리,CERCA,251,2025-09-10 07:42:56
DJUSGT,Dow Jones U.S. General Retailers Index,3645.7,2720.3,3649.5,34.01830680439656,38.37181044957478,游댮,FUERTE,251,2025-09-10 07:42:56
DJUSGU,Dow Jones U.S. Gas Distribution Index,367.89,300.5,378.12,22.425956738768715,53.98142003981427,游리,CERCA,251,2025-09-10 07:42:56
DJUSHB,Dow Jones U.S. Home Construction Index,2792.19,1872.38,3170.03,49.12517758147384,41.15997088533436,游댮,FUERTE,251,2025-09-10 07:42:56
DJUSHC,Dow Jones U.S. Health Care Index,1477.67,1344.15,1658.61,9.933415169437932,38.46819142802224,游릭,OPORTUNIDAD,251,2025-09-10 07:42:56
DJUSHD,Dow Jones U.S. Durable Household Products Index,142.54,94.51,179.28,50.82001904560363,47.856049004594176,游댮,FUERTE,251,2025-09-10 07:42:56
DJUSHG,Dow Jones U.S. Household Goods & Home Construction Index,1099.55,999.49,1229.25,10.011105663888578,43.774377437743745,游리,CERCA,251,2025-09-10 07:42:56
DJUSHI,Dow Jones U.S. Home Improvement Retailers Index,916.82,705.04,958.3,30.038012027686385,39.7466216216216,游댮,FUERTE,251,2025-09-10 07:42:56
DJUSHL,Dow Jones U.S. Hotel & Lodging REITs Index,92.8,65.02,103.03,42.72531528760382,22.142286171063205,游댮,FUERTE,251,2025-09-10 07:42:56
DJUSHN,Dow Jones U.S. Nondurable Household Products Index,1240.83,1180.41,1421.48,5.1185605001651835,48.38806567881457,游릭,OPORTUNIDAD,251,2025-09-10 07:42:56
DJUSHP,Dow Jones U.S. Health Care Providers Index,2612.6,2106.6,3506.1,24.01974746036267,22.987616099071133,游리,CERCA,251,2025-09-10 07:42:56
DJUSHR,Dow Jones U.S. Commercial Vehicles & Trucks Index,5268.2,3916.0,5508.8,34.53013278855975,54.748283752860445,游댮,FUERTE,251,2025-09-10 07:42:56
DJUSHV,Dow Jones U.S. Heavy Construction Index,1965.88,1138.85,2114.89,72.61974799139486,48.55437100213215,游댮,FUERTE,251,2025-09-10 07:42:56
DJUSIB,Dow Jones U.S. Insurance Brokers Index,760.19,729.23,891.38,4.24557409870686,77.2228033472804,游릭,OPORTUNIDAD,251,2025-09-10 07:42:56
DJUSID,Dow Jones U.S. Diversified Industrials Index,926.21,767.22,1017.95,20.722869581084957,54.68298323376369,游리,CERCA,251,2025-09-10 07:42:56
DJUSIG,Dow Jones U.S. Industrial Goods & Services Index,1436.96,1094.74,1484.13,31.260390595027133,52.03374258748848,游댮,FUERTE,251,2025-09-10 07:42:56
DJUSIL,Dow Jones U.S. Life Insurance Index,1256.84,1077.94,1380.29,16.596471046625958,46.62263584509157,游리,CERCA,251,2025-09-10 07:42:56
DJUSIM,Dow Jones U.S. Industrial Metals & Mining Index,510.64,350.58,568.14,45.65577043756062,41.67899905825371,游댮,FUERTE,251,2025-09-10 07:42:56
DJUSIO,Dow Jones U.S. Industrial & Office REITs Index,101.56,79.12,119.27,28.36198179979777,43.51732991014122,游댮,FUERTE,251,2025-09-10 07:42:56
DJUSIP,Dow Jones U.S. Property & Casualty Insurance Index,1927.52,1755.13,2065.57,9.822064462461462,56.752105230807054,游릭,OPORTUNIDAD,251,2025-09-10 07:42:56
DJUSIQ,Dow Jones U.S. Industrial Engineering Index,4355.1,3318.0,4522.4,31.256781193490063,52.696793002915406,游댮,FUERTE,251,2025-09-10 07:42:56
DJUSIR,Dow Jones U.S. Insurance Index,1337.84,1264.26,1458.0,5.820005378640464,58.71491875923188,游릭,OPORTUNIDAD,251,2025-09-10 07:42:56
DJUSIS,Dow Jones U.S. Support Services Index,859.2,764.29,981.89,12.41806120713343,59.27413570506382,游리,CERCA,251,2025-09-10 07:42:56
DJUSIT,Dow Jones U.S. Industrial Transportation Index,1395.5,1243.5,1746.8,12.22356252513068,73.07692307692308,游리,CERCA,251,2025-09-10 07:42:56
DJUSIU,Dow Jones U.S. Reinsurance Index,513.86,467.58,599.38,9.89777150434151,50.33480007652575,游릭,OPORTUNIDAD,251,2025-09-10 07:42:56
DJUSIV,Dow Jones U.S. Business Support Services Index,1156.52,1092.82,1443.42,5.8289562782525985,61.95485650086818,游릭,OPORTUNIDAD,251,2025-09-10 07:42:56
DJUSIX,Dow Jones U.S. Nonlife Insurance Index,1326.75,1246.37,1458.15,6.449128268491709,61.92350956130482,游릭,OPORTUNIDAD,251,2025-09-10 07:42:56
DJUSLE,Dow Jones U.S. Leisure Goods Index,1159.12,724.03,1172.02,60.092813833680914,28.514285714285762,游댮,FUERTE,251,2025-09-10 07:42:56
DJUSLG,Dow Jones U.S. Hotels Index,4268.2,3245.4,4663.6,31.515375608553637,49.752720079129574,游댮,FUERTE,251,2025-09-10 07:42:56
DJUSMC,Dow Jones U.S. Health Care Equipment & Services Index,2312.0,2083.0,2559.1,10.99375900144023,33.62467866323912,游리,CERCA,251,2025-09-10 07:42:56
DJUSME,Dow Jones U.S. Media Index,837.07,662.35,936.97,26.37880274779196,43.666513127590974,游댮,FUERTE,251,2025-09-10 07:42:56
DJUSMF,Dow Jones U.S. Mortgage Finance Index,13.15,9.98,13.32,31.763527054108216,38.30845771144275,游댮,FUERTE,251,2025-09-10 07:42:56
DJUSMG,Dow Jones U.S. Mining Index,174.76,84.25,176.58,107.43026706231453,8.323471400394524,游댮,FUERTE,251,2025-09-10 07:42:56
DJUSMR,Dow Jones U.S. Mortgage REITs Index,32.45,24.64,32.57,31.69642857142858,25.97765363128481,游댮,FUERTE,251,2025-09-10 07:42:56
DJUSMS,Dow Jones U.S. Medical Supplies Index,1605.87,1469.4,1749.93,9.28746427113106,43.31531531531531,游릭,OPORTUNIDAD,251,2025-09-10 07:42:56
DJUSMT,Dow Jones U.S. Marine Transportation Index,288.44,275.54,433.97,4.681715903317114,75.57542882275328,游릭,OPORTUNIDAD,251,2025-09-10 07:42:56
DJUSMU,Dow Jones U.S. Multiutilities Index,276.33,249.55,292.91,10.731316369465025,71.74515235457076,游리,CERCA,251,2025-09-10 07:42:56
DJUSNF,Dow Jones U.S. Nonferrous Metals Index,587.11,372.55,702.28,57.59226949402765,37.219907225410786,游댮,FUERTE,251,2025-09-10 07:42:56
DJUSNG,Dow Jones U.S. Personal & Household Goods Index,1071.12,909.61,1081.16,17.75596134607138,46.509129967776566,游리,CERCA,251,2025-09-10 07:42:56
DJUSNS,Dow Jones U.S. Internet Index,6348.0,3842.4,6355.4,65.20924422236102,16.589719913819692,游댮,FUERTE,251,2025-09-10 07:42:56
DJUSOG,Dow Jones U.S. Oil & Gas Producers,834.45,707.01,914.32,18.02520473543515,39.12243825538623,游리,CERCA,251,2025-09-10 07:42:56
DJUSOI,Dow Jones U.S. Oil Equipment & Services Index,254.66,198.86,294.15,28.059941667504766,29.007820136852402,游댮,FUERTE,251,2025-09-10 07:42:56
DJUSOL,Dow Jones U.S. Integrated Oil & Gas Index,738.19,645.42,807.01,14.373586191937049,40.87504927079224,游리,CERCA,251,2025-09-10 07:42:56
DJUSOS,Dow Jones U.S. Exploration & Production Index,1014.73,821.29,1123.35,23.553190712172324,37.50167988173629,游리,CERCA,251,2025-09-10 07:42:56
DJUSPB,Dow Jones U.S. Publishing Index,835.26,663.16,874.35,25.951504915857416,62.65310838918413,游댮,FUERTE,251,2025-09-10 07:42:56
DJUSPC,Dow Jones U.S. Waste & Disposal Services Index,660.24,609.51,708.03,8.32307919476301,71.6159695817491,游릭,OPORTUNIDAD,251,2025-09-10 07:42:56
DJUSPG,Sector PG,531.39,426.49,649.12,24.596121831695932,61.30913804277384,游리,CERCA,251,2025-09-10 07:42:56
DJUSPL,Dow Jones U.S. Pipelines Index,1014.96,872.35,1229.95,16.347796182724824,46.284032376747575,游리,CERCA,251,2025-09-10 07:42:56
DJUSPM,Dow Jones U.S. Gold Mining Index,196.74,94.85,198.79,107.42224565102796,8.277797264117964,游댮,FUERTE,251,2025-09-10 07:42:56
DJUSPN,Dow Jones U.S. Pharmaceuticals & Biotechnology Index,1117.76,960.01,1270.52,16.432120498744805,43.65036476627936,游리,CERCA,251,2025-09-10 07:42:56
DJUSPR,Dow Jones U.S. Pharmaceuticals Index,862.39,765.56,995.53,12.648257484717076,39.228435197225885,游리,CERCA,251,2025-09-10 07:42:56
DJUSRA,Dow Jones U.S. Apparel Retailers Index,1846.14,1490.78,1889.65,23.837185902681828,35.93046937905554,游리,CERCA,251,2025-09-10 07:42:56
DJUSRB,Dow Jones U.S. Broadline Retailers Index,4961.5,3641.4,5034.6,36.25254023177899,41.050832977360116,游댮,FUERTE,251,2025-09-10 07:42:56
DJUSRD,Dow Jones U.S. Drug Retailers Index,1158.36,838.78,1209.83,38.100574644125984,44.73094170403588,游댮,FUERTE,251,2025-09-10 07:42:56
DJUSRE,Dow Jones U.S. Real Estate Index,368.41,311.91,396.67,18.11419960886153,45.00612745098033,游리,CERCA,251,2025-09-10 07:42:56
DJUSRH,Dow Jones U.S. Real Estate Investment & Services,792.53,563.1,811.4,40.7440951873557,45.18129770992365,游댮,FUERTE,251,2025-09-10 07:42:56
DJUSRI,Dow Jones U.S. Real Estate Investment Trusts Index,147.62,126.8,162.95,16.41955835962146,45.13618677042798,游리,CERCA,251,2025-09-10 07:42:56
DJUSRL,Dow Jones U.S. Retail REITs Index,101.68,83.32,106.75,22.035525684109476,39.559164733178626,游리,CERCA,251,2025-09-10 07:42:56
DJUSRN,Dow Jones U.S. Residential REITs Index,229.95,212.75,271.87,8.084606345475907,42.72353161242053,游릭,OPORTUNIDAD,251,2025-09-10 07:42:56
DJUSRP,Dow Jones U.S. Recreational Products Index,396.16,305.34,496.77,29.743892054758646,49.05605293888673,游댮,FUERTE,251,2025-09-10 07:42:56
DJUSRQ,Dow Jones U.S. Recreational Services Index,206.89,109.38,215.97,89.14792466630097,39.75724547931636,游댮,FUERTE,251,2025-09-10 07:42:56
DJUSRR,Dow Jones U.S. Railroads Index,3222.6,2788.9,3607.9,15.550934060023657,79.81347773766558,游리,CERCA,251,2025-09-10 07:42:56
DJUSRS,Dow Jones U.S. Specialty Retailers Index,4902.6,3023.0,4908.8,62.17664571617599,31.66014776184265,游댮,FUERTE,251,2025-09-10 07:42:56
DJUSRT,Dow Jones U.S. Retail Index,3264.3,2453.4,3267.5,33.05209097578871,38.19124423963133,游댮,FUERTE,251,2025-09-10 07:42:56
DJUSRU,Dow Jones U.S. Restaurants & Bars Index,3015.0,2686.2,3265.8,12.240339513066793,70.6606217616579,游리,CERCA,251,2025-09-10 07:42:56
DJUSSB,Dow Jones U.S. Investment Services Index,2997.4,2060.8,3053.4,45.448369565217384,43.71487725524992,游댮,FUERTE,251,2025-09-10 07:42:56
DJUSSC,Dow Jones U.S. Semiconductors Index,25049.0,12938.1,26004.7,93.6064800859477,45.33217542336084,游댮,FUERTE,251,2025-09-10 07:42:56
DJUSSD,Dow Jones U.S. Soft Drinks Index,899.75,835.84,1009.81,7.646200229709031,76.66598943518886,游릭,OPORTUNIDAD,251,2025-09-10 07:42:56
DJUSSF,Dow Jones U.S. Consumer Finance Index,791.57,607.06,809.9,30.39403024412745,40.898683457355425,游댮,FUERTE,251,2025-09-10 07:42:56
DJUSSP,Dow Jones U.S. Specialty Finance Index,737.74,658.62,803.35,12.012996872248035,42.98607924124219,游리,CERCA,251,2025-09-10 07:42:56
DJUSSR,Dow Jones U.S. Specialty REITs Index,260.2,229.18,287.27,13.535212496727455,51.85873605947959,游리,CERCA,251,2025-09-10 07:42:56
DJUSST,Dow Jones U.S. Iron & Steel Index,582.99,416.26,642.02,40.054292989958206,50.95987811071609,游댮,FUERTE,251,2025-09-10 07:42:56
DJUSSV,Dow Jones U.S. Software & Computer Services Index,8304.0,5509.7,8349.7,50.71600994609508,27.778452568929964,游댮,FUERTE,251,2025-09-10 07:42:56
DJUSSW,Dow Jones U.S. Software Index,8325.2,5758.2,8972.9,44.57990344204788,47.82485475414477,游댮,FUERTE,251,2025-09-10 07:42:56
DJUSTB,Dow Jones U.S. Tobacco Index,1139.25,824.94,1210.02,38.100952796567015,56.79633284522821,游댮,FUERTE,251,2025-09-10 07:42:56
DJUSTC,Dow Jones U.S. Technology Index,8146.5,5115.5,8176.9,59.251295083569545,34.8448984676716,游댮,FUERTE,251,2025-09-10 07:42:56
DJUSTK,Dow Jones U.S. Trucking Index,1400.58,1244.48,2071.67,12.543391617382351,56.122481869460124,游리,CERCA,251,2025-09-10 07:42:56
DJUSTL,Dow Jones U.S. Telecommunications Index,191.99,155.76,199.75,23.26014381099128,58.43263061411543,游리,CERCA,251,2025-09-10 07:42:56
DJUSTQ,Dow Jones U.S. Technology Hardware & Equipment Index,8972.1,5326.7,9145.4,68.43636773236715,42.810522151898745,游댮,FUERTE,251,2025-09-10 07:42:56
DJUSTR,Dow Jones U.S. Tires Index,8972.1,5326.7,9145.4,68.43636773236715,42.810522151898745,游댮,FUERTE,251,2025-09-10 07:42:56
DJUSTT,Dow Jones U.S. Travel & Tourism Index,1388.04,957.74,1425.35,44.928686282289554,48.58735657068629,游댮,FUERTE,251,2025-09-10 07:42:56
DJUSTY,Dow Jones U.S. Toys Index,1897.59,1098.6,1934.76,72.72801747678864,29.34261584113223,游댮,FUERTE,251,2025-09-10 07:42:56
DJUSUT,Dow Jones U.S. Utilities Index,412.76,353.79,435.98,16.66807993442437,74.51321279554942,游리,CERCA,251,2025-09-10 07:42:56
DJUSVE,Dow Jones U.S. Conventional Electricity Index,410.02,341.92,434.77,19.91693963500233,75.45673905549813,游리,CERCA,251,2025-09-10 07:42:56
DJUSVN,Dow Jones U.S. Distillers & Vintners Index,293.32,291.3,523.8,0.6934431857191835,72.4279353175533,游릭,OPORTUNIDAD,251,2025-09-10 07:42:56
DJUSWC,Dow Jones U.S. Mobile Telecommunications Index,417.22,360.57,458.56,15.711234989045133,72.59733859043862,游리,CERCA,251,2025-09-10 07:42:56
DJUSWU,Dow Jones U.S. Water Index,2852.3,2432.7,3135.8,17.248324906482527,64.68401486988844,游리,CERCA,251,2025-09-10 07:42:56
