Ticker,Sector,CurrentPrice,Min52w,Max52w,DistanceFromMin,RSI,Estado,Classification,DataPoints,AnalysisDate
DJUSFR,Dow Jones U.S. Forestry & Paper Index,802.5,703.58,931.93,14.059524147929157,62.00743494423793,游리,CERCA,250,2025-10-27 07:44:22
DJUSAE,Dow Jones U.S. Aerospace & Defense Index,2949.8,1861.2,2969.6,58.48914678701913,44.16773094934014,游댮,FUERTE,250,2025-10-27 07:44:22
DJUSAF,Dow Jones U.S. Delivery Services Index,1035.5,916.9,1383.0,12.934889300905228,55.69461827284105,游리,CERCA,250,2025-10-27 07:44:22
DJUSAG,Dow Jones U.S. Asset Managers Index,387.18,273.77,426.58,41.425283997516175,59.67741935483873,游댮,FUERTE,250,2025-10-27 07:44:22
DJUSAI,Dow Jones U.S. Electronic Equipment Index,1793.71,913.78,1819.18,96.29560725776446,38.89770779097083,游댮,FUERTE,250,2025-10-27 07:44:22
DJUSAL,Dow Jones U.S. Aluminum Index,134.67,73.62,163.19,82.92583537082312,36.64259927797836,游댮,FUERTE,250,2025-10-27 07:44:22
DJUSAM,Dow Jones U.S. Medical Equipment Index,2995.2,2589.3,3151.1,15.676051442474783,39.223021582733864,游리,CERCA,250,2025-10-27 07:44:22
DJUSAP,Dow Jones U.S. Automobiles & Parts Index,1625.29,845.49,1748.7,92.23054086979148,55.45832421789544,游댮,FUERTE,250,2025-10-27 07:44:22
DJUSAR,Dow Jones U.S. Airlines Index,229.95,137.83,259.72,66.8359573387506,49.90237099023711,游댮,FUERTE,250,2025-10-27 07:44:22
DJUSAS,Dow Jones U.S. Aerospace Index,3186.7,1883.9,3214.3,69.15441371622695,40.06386175807665,游댮,FUERTE,250,2025-10-27 07:44:22
DJUSAT,Dow Jones U.S. Auto Parts Index,421.97,288.25,447.84,46.39028620988726,65.05613187437828,游댮,FUERTE,250,2025-10-27 07:44:22
DJUSAU,Dow Jones U.S. Automobiles Index,1484.26,758.25,1613.6,95.74810418727333,55.0993530499076,游댮,FUERTE,250,2025-10-27 07:44:22
DJUSAV,Dow Jones U.S. Media Agencies Index,435.56,346.44,702.93,25.724512181041455,46.34881490615154,游댮,FUERTE,250,2025-10-27 07:44:22
DJUSBC,Dow Jones U.S. Broadcasting & Entertainment Index,1183.7,962.0,1294.9,23.04573804573805,60.356731875719206,游리,CERCA,250,2025-10-27 07:44:22
DJUSBD,Dow Jones U.S. Building Materials & Fixtures Index,2398.3,1876.9,2557.1,27.779849752251057,52.26594301221165,游댮,FUERTE,250,2025-10-27 07:44:22
DJUSBE,Dow Jones U.S. Business Training & Employment Agencies Index,106.17,104.12,152.72,1.9688820591625018,57.49354005167955,游릭,OPORTUNIDAD,250,2025-10-27 07:44:22
DJUSBK,Dow Jones U.S. Banks Index,766.17,521.55,799.76,46.902502157031925,51.25269978401729,游댮,FUERTE,250,2025-10-27 07:44:22
DJUSBS,Dow Jones U.S. Basic Resources Index,445.91,274.91,478.98,62.20217525735695,52.329291640076576,游댮,FUERTE,250,2025-10-27 07:44:22
DJUSBT,Dow Jones U.S. Biotechnology Index,3032.6,2297.4,3068.1,32.00139287890658,30.459770114942614,游댮,FUERTE,250,2025-10-27 07:44:22
DJUSBV,Dow Jones U.S. Beverages Index,958.96,875.4,1016.27,9.545350696824316,25.776154448212864,游릭,OPORTUNIDAD,250,2025-10-27 07:44:22
DJUSCA,Dow Jones U.S. Gambling Index,653.42,513.6,786.57,27.223520249221174,53.227964542565665,游댮,FUERTE,250,2025-10-27 07:44:22
DJUSCC,Dow Jones U.S. Commodity Chemicals Index,690.33,647.09,830.12,6.682223492868072,68.30895260386188,游릭,OPORTUNIDAD,250,2025-10-27 07:44:22
DJUSCH,Dow Jones U.S. Chemicals Index,1941.56,1497.87,2050.51,29.621395715248994,55.45702897577145,游댮,FUERTE,250,2025-10-27 07:44:22
DJUSCM,Dow Jones U.S. Personal Products Index,373.96,345.1,458.91,8.362793393219343,47.308048103607774,游릭,OPORTUNIDAD,250,2025-10-27 07:44:22
DJUSCN,Dow Jones U.S. Construction & Materials Index,2089.94,1484.39,2101.53,40.794535128908166,47.28340285342327,游댮,FUERTE,250,2025-10-27 07:44:22
DJUSCP,Dow Jones U.S. Containers & Packaging Index,436.55,397.01,541.01,9.95944686531826,40.84252395588503,游릭,OPORTUNIDAD,250,2025-10-27 07:44:22
DJUSCR,Dow Jones U.S. Computer Hardware Index,13267.9,8364.8,13336.1,58.61586648814079,43.70636858109555,游댮,FUERTE,250,2025-10-27 07:44:22
DJUSCS,Dow Jones U.S. Specialized Consumer Services Index,2699.2,2651.3,3402.3,1.8066608833402344,53.00776196636486,游릭,OPORTUNIDAD,250,2025-10-27 07:44:22
DJUSCT,Dow Jones U.S. Telecommunications Equipment Index,2702.53,1708.47,2771.34,58.18422331091563,43.34043533341009,游댮,FUERTE,250,2025-10-27 07:44:22
DJUSCX,Dow Jones U.S. Specialty Chemicals Index,1064.64,863.05,1195.08,23.357858756734853,53.81094071869992,游리,CERCA,250,2025-10-27 07:44:22
DJUSDB,Dow Jones U.S. Brewers Index,463.88,447.85,659.78,3.5793234341855467,51.860222531293445,游릭,OPORTUNIDAD,250,2025-10-27 07:44:22
DJUSDN,Dow Jones U.S. Defense Index,825.18,598.11,850.34,37.96458845362892,55.287628053585536,游댮,FUERTE,250,2025-10-27 07:44:22
DJUSDR,Dow Jones U.S. Food & Drug Retailers Index,1573.91,1264.81,1615.62,24.43845320641046,34.560862865947485,游리,CERCA,250,2025-10-27 07:44:22
DJUSDS,Dow Jones U.S. Industrial Suppliers Index,941.89,683.22,994.97,37.860425631568155,58.783403656821385,游댮,FUERTE,250,2025-10-27 07:44:22
DJUSDT,Dow Jones U.S. Diversified REITs Index,57.44,45.49,60.0,26.26950978236974,61.58415841584157,游댮,FUERTE,250,2025-10-27 07:44:22
DJUSDV,Dow Jones U.S. Computer Services Index,296.8,231.08,304.29,28.44036697247706,37.36481614996395,游댮,FUERTE,250,2025-10-27 07:44:22
DJUSEC,Dow Jones U.S. Electrical Components & Equipment Index,1051.6,562.61,1072.04,86.91455893069798,43.947036569987425,游댮,FUERTE,250,2025-10-27 07:44:22
DJUSEE,Dow Jones U.S. Electronic & Electrical Equipment Index,1222.66,643.85,1242.11,89.89826823017785,42.10478852917305,游댮,FUERTE,250,2025-10-27 07:44:22
DJUSEH,Dow Jones U.S. Real Estate Holding & Development Index,68.56,50.8,72.61,34.96062992125986,24.62825278810412,游댮,FUERTE,225,2025-10-27 07:44:22
DJUSEN,Dow Jones U.S. Oil & Gas Index,742.64,623.85,813.7,19.041436242686537,55.91420241566013,游리,CERCA,250,2025-10-27 07:44:22
DJUSES,Dow Jones U.S. Real Estate Services Index,359.74,268.15,392.49,34.156255826962536,39.103362391033606,游댮,FUERTE,250,2025-10-27 07:44:22
DJUSEU,Dow Jones U.S. Electricity Index,456.88,340.99,471.47,33.986333910085335,41.60437556973565,游댮,FUERTE,250,2025-10-27 07:44:22
DJUSFA,Dow Jones U.S. Financial Administration Index,553.06,532.41,685.16,3.8785898086061454,52.7554468134685,游릭,OPORTUNIDAD,250,2025-10-27 07:44:22
DJUSFB,Dow Jones U.S. Food & Beverage Index,709.43,668.77,776.66,6.079818173662091,30.457746478873247,游릭,OPORTUNIDAD,250,2025-10-27 07:44:22
DJUSFC,Dow Jones U.S. Fixed Line Telecommunications Index,149.69,127.84,175.95,17.091677096370457,58.69842620161636,游리,CERCA,250,2025-10-27 07:44:22
DJUSFD,Dow Jones U.S. Food Retailers & Wholesalers Index,1219.43,1076.27,1346.72,13.301494978025968,51.01325613286601,游리,CERCA,250,2025-10-27 07:44:22
DJUSFE,Dow Jones U.S. Industrial Machinery Index,1264.06,969.18,1325.15,30.425720712354774,51.12093945401863,游댮,FUERTE,250,2025-10-27 07:44:22
DJUSFH,Dow Jones U.S. Furnishings Index,464.54,319.67,507.6,45.31860981637313,57.46794501559432,游댮,FUERTE,250,2025-10-27 07:44:22
DJUSFI,Dow Jones U.S. Financial Services Index,2472.6,1907.9,2532.3,29.59798731589705,51.86476124085053,游댮,FUERTE,250,2025-10-27 07:44:22
DJUSFO,Dow Jones U.S. Food Producers Index,374.4,367.79,435.91,1.7972212403817276,57.12515489467167,游릭,OPORTUNIDAD,250,2025-10-27 07:44:22
DJUSFP,Dow Jones U.S. Food Products Index,519.36,518.27,627.91,0.21031508673086072,62.65220700152204,游릭,OPORTUNIDAD,250,2025-10-27 07:44:22
DJUSFT,Dow Jones U.S. Footwear Index,1452.0,1186.7,1942.6,22.35611359231482,59.90495990495991,游리,CERCA,250,2025-10-27 07:44:22
DJUSGF,Dow Jones U.S. Financial Services Index,2771.5,2138.5,2838.4,29.600187046995558,51.86683260734287,游댮,FUERTE,250,2025-10-27 07:44:22
DJUSGI,Dow Jones U.S. General Industrials Index,729.93,613.23,783.86,19.030380118389502,39.045051983057405,游리,CERCA,250,2025-10-27 07:44:22
DJUSGT,Dow Jones U.S. General Retailers Index,3450.2,2720.3,3649.5,26.831599455942346,48.708487084870846,游댮,FUERTE,250,2025-10-27 07:44:22
DJUSGU,Dow Jones U.S. Gas Distribution Index,386.71,304.15,390.51,27.1445010685517,41.33252939403074,游댮,FUERTE,250,2025-10-27 07:44:22
DJUSHB,Dow Jones U.S. Home Construction Index,2557.91,1872.38,2981.07,36.612760230295116,63.503379114889924,游댮,FUERTE,250,2025-10-27 07:44:22
DJUSHC,Dow Jones U.S. Health Care Index,1557.62,1344.15,1597.65,15.881412044786652,37.41286863270781,游리,CERCA,250,2025-10-27 07:44:22
DJUSHD,Dow Jones U.S. Durable Household Products Index,115.09,94.51,179.28,21.775473494868265,52.98013245033111,游리,CERCA,250,2025-10-27 07:44:22
DJUSHG,Dow Jones U.S. Household Goods & Home Construction Index,1029.61,999.49,1216.79,3.013536903820938,53.83785080355005,游릭,OPORTUNIDAD,250,2025-10-27 07:44:22
DJUSHI,Dow Jones U.S. Home Improvement Retailers Index,846.01,705.04,958.3,19.994610234880295,52.353810428541294,游리,CERCA,250,2025-10-27 07:44:22
DJUSHL,Dow Jones U.S. Hotel & Lodging REITs Index,87.74,65.02,103.03,34.94309443248231,52.27422544495719,游댮,FUERTE,250,2025-10-27 07:44:22
DJUSHN,Dow Jones U.S. Nondurable Household Products Index,1172.78,1140.99,1420.24,2.7861769165373897,46.44565396668322,游릭,OPORTUNIDAD,250,2025-10-27 07:44:22
DJUSHP,Dow Jones U.S. Health Care Providers Index,2744.1,2106.6,3422.4,30.262033608658502,45.945945945946,游댮,FUERTE,250,2025-10-27 07:44:22
DJUSHR,Dow Jones U.S. Commercial Vehicles & Trucks Index,5839.2,3916.0,5880.6,49.111338100102145,42.14555476166174,游댮,FUERTE,250,2025-10-27 07:44:22
DJUSHV,Dow Jones U.S. Heavy Construction Index,2330.76,1138.85,2350.64,104.65908592000706,39.27973199329981,游댮,FUERTE,250,2025-10-27 07:44:22
DJUSIB,Dow Jones U.S. Insurance Brokers Index,712.93,711.7,891.38,0.17282562877615631,75.82522585128555,游릭,OPORTUNIDAD,250,2025-10-27 07:44:22
DJUSID,Dow Jones U.S. Diversified Industrials Index,966.4,767.22,1017.95,25.961262740804454,38.91362835142408,游댮,FUERTE,250,2025-10-27 07:44:22
DJUSIG,Dow Jones U.S. Industrial Goods & Services Index,1497.71,1094.74,1509.85,36.80965343369202,46.87743342158543,游댮,FUERTE,250,2025-10-27 07:44:22
DJUSIL,Dow Jones U.S. Life Insurance Index,1244.17,1077.94,1380.29,15.421080950702265,64.45702459215971,游리,CERCA,250,2025-10-27 07:44:22
DJUSIM,Dow Jones U.S. Industrial Metals & Mining Index,516.42,350.58,568.14,47.30446688345028,42.535739395359755,游댮,FUERTE,250,2025-10-27 07:44:22
DJUSIO,Dow Jones U.S. Industrial & Office REITs Index,110.45,79.12,111.84,39.59807886754297,35.714285714285694,游댮,FUERTE,250,2025-10-27 07:44:22
DJUSIP,Dow Jones U.S. Property & Casualty Insurance Index,1872.4,1755.13,2065.57,6.681556351951136,68.27375606251121,游릭,OPORTUNIDAD,250,2025-10-27 07:44:22
DJUSIQ,Dow Jones U.S. Industrial Engineering Index,4623.1,3318.0,4646.3,39.33393610608801,45.83956899131992,游댮,FUERTE,250,2025-10-27 07:44:22
DJUSIR,Dow Jones U.S. Insurance Index,1293.34,1264.26,1458.0,2.3001597772610007,71.430168847143,游릭,OPORTUNIDAD,250,2025-10-27 07:44:22
DJUSIS,Dow Jones U.S. Support Services Index,830.65,764.29,981.89,8.682568135131955,55.45212765957447,游릭,OPORTUNIDAD,250,2025-10-27 07:44:22
DJUSIT,Dow Jones U.S. Industrial Transportation Index,1435.3,1243.5,1746.8,15.424205870526736,65.46916890080428,游리,CERCA,250,2025-10-27 07:44:22
DJUSIU,Dow Jones U.S. Reinsurance Index,520.69,467.58,599.38,11.358484109671089,70.18894331700483,游리,CERCA,250,2025-10-27 07:44:22
DJUSIV,Dow Jones U.S. Business Support Services Index,1118.71,1072.64,1443.42,4.29501044152744,54.79845389287683,游릭,OPORTUNIDAD,250,2025-10-27 07:44:22
DJUSIX,Dow Jones U.S. Nonlife Insurance Index,1276.93,1246.37,1458.15,2.451920376774166,71.67149447484177,游릭,OPORTUNIDAD,250,2025-10-27 07:44:22
DJUSLE,Dow Jones U.S. Leisure Goods Index,1186.83,724.03,1249.95,63.92000331477977,48.80937302089931,游댮,FUERTE,250,2025-10-27 07:44:22
DJUSLG,Dow Jones U.S. Hotels Index,4232.7,3245.4,4663.6,30.421519689406534,47.78074866310161,游댮,FUERTE,250,2025-10-27 07:44:22
DJUSMC,Dow Jones U.S. Health Care Equipment & Services Index,2361.1,2083.0,2553.7,13.350936149783962,38.95619757688725,游리,CERCA,250,2025-10-27 07:44:22
DJUSME,Dow Jones U.S. Media Index,814.64,662.35,936.97,22.99237563221861,58.76604062207868,游리,CERCA,250,2025-10-27 07:44:22
DJUSMF,Dow Jones U.S. Mortgage Finance Index,12.52,9.98,13.76,25.450901803607206,40.33149171270719,游댮,FUERTE,250,2025-10-27 07:44:22
DJUSMG,Dow Jones U.S. Mining Index,189.81,84.25,223.28,125.29376854599408,57.07337703531402,游댮,FUERTE,250,2025-10-27 07:44:22
DJUSMR,Dow Jones U.S. Mortgage REITs Index,30.31,24.64,32.68,23.011363636363626,44.141689373297,游리,CERCA,250,2025-10-27 07:44:22
DJUSMS,Dow Jones U.S. Medical Supplies Index,1756.89,1472.69,1772.35,19.29801927085809,18.11340339950695,游리,CERCA,250,2025-10-27 07:44:22
DJUSMT,Dow Jones U.S. Marine Transportation Index,285.15,261.01,433.97,9.24868778973985,37.87489288774636,游릭,OPORTUNIDAD,250,2025-10-27 07:44:22
DJUSMU,Dow Jones U.S. Multiutilities Index,294.9,249.55,299.75,18.172710879583235,46.866359447004704,游리,CERCA,250,2025-10-27 07:44:22
DJUSNF,Dow Jones U.S. Nonferrous Metals Index,553.4,372.55,658.01,48.5438196215273,45.597543397881815,游댮,FUERTE,250,2025-10-27 07:44:22
DJUSNG,Dow Jones U.S. Personal & Household Goods Index,1025.14,909.61,1081.16,12.701047701762302,50.536062378167514,游리,CERCA,250,2025-10-27 07:44:22
DJUSNS,Dow Jones U.S. Internet Index,6569.3,3842.4,6645.5,70.96866541744743,38.94870170994298,游댮,FUERTE,250,2025-10-27 07:44:22
DJUSOG,Dow Jones U.S. Oil & Gas Producers,846.51,707.01,914.32,19.730979759833666,53.13891556797349,游리,CERCA,250,2025-10-27 07:44:22
DJUSOI,Dow Jones U.S. Oil Equipment & Services Index,266.34,198.86,294.15,33.93342049683192,46.09814963797268,游댮,FUERTE,250,2025-10-27 07:44:22
DJUSOL,Dow Jones U.S. Integrated Oil & Gas Index,756.37,645.42,806.96,17.19035666697655,46.821008984105056,游리,CERCA,250,2025-10-27 07:44:22
DJUSOS,Dow Jones U.S. Exploration & Production Index,1014.24,821.29,1123.35,23.493528473499016,59.083277367360644,游리,CERCA,250,2025-10-27 07:44:22
DJUSPB,Dow Jones U.S. Publishing Index,778.82,663.16,874.35,17.440738283370543,62.57813421394029,游리,CERCA,250,2025-10-27 07:44:22
DJUSPC,Dow Jones U.S. Waste & Disposal Services Index,649.41,609.51,708.03,6.546242063296743,52.997250229147575,游릭,OPORTUNIDAD,250,2025-10-27 07:44:22
DJUSPG,Sector PG,508.41,426.49,649.12,19.20795329316045,53.20053715308861,游리,CERCA,250,2025-10-27 07:44:22
DJUSPL,Dow Jones U.S. Pipelines Index,982.79,925.07,1229.95,6.2395278195163515,75.63267772034649,游릭,OPORTUNIDAD,250,2025-10-27 07:44:22
DJUSPM,Dow Jones U.S. Gold Mining Index,214.33,94.85,251.35,125.96731681602533,56.90286837637387,游댮,FUERTE,250,2025-10-27 07:44:22
DJUSPN,Dow Jones U.S. Pharmaceuticals & Biotechnology Index,1203.66,960.01,1211.74,25.379943958917107,42.08389715832194,游댮,FUERTE,250,2025-10-27 07:44:22
DJUSPR,Dow Jones U.S. Pharmaceuticals Index,913.1,765.56,963.2,19.27216677987357,60.158680771624105,游리,CERCA,250,2025-10-27 07:44:22
DJUSRA,Dow Jones U.S. Apparel Retailers Index,1876.49,1490.78,1923.54,25.873032908946996,48.0979827089337,游댮,FUERTE,250,2025-10-27 07:44:22
DJUSRB,Dow Jones U.S. Broadline Retailers Index,4757.9,3641.4,5034.6,30.661284121491722,43.13199105145415,游댮,FUERTE,250,2025-10-27 07:44:22
DJUSRD,Dow Jones U.S. Drug Retailers Index,1272.7,860.93,1277.12,47.828511028771224,17.98048048048051,游댮,FUERTE,250,2025-10-27 07:44:22
DJUSRE,Dow Jones U.S. Real Estate Index,373.13,311.91,396.19,19.627456638132784,36.47288080545635,游리,CERCA,250,2025-10-27 07:44:22
DJUSRH,Dow Jones U.S. Real Estate Investment & Services,754.43,563.1,822.79,33.97797904457466,39.10719588241117,游댮,FUERTE,250,2025-10-27 07:44:22
DJUSRI,Dow Jones U.S. Real Estate Investment Trusts Index,150.37,126.8,161.13,18.588328075709786,36.82514101531013,游리,CERCA,250,2025-10-27 07:44:22
DJUSRL,Dow Jones U.S. Retail REITs Index,101.89,83.32,106.33,22.2875660105617,44.061302681992274,游리,CERCA,250,2025-10-27 07:44:22
DJUSRN,Dow Jones U.S. Residential REITs Index,220.14,212.75,264.7,3.4735605170387713,43.43185550082106,游릭,OPORTUNIDAD,250,2025-10-27 07:44:22
DJUSRP,Dow Jones U.S. Recreational Products Index,357.1,305.34,496.77,16.951594943341867,62.03568294823045,游리,CERCA,250,2025-10-27 07:44:22
DJUSRQ,Dow Jones U.S. Recreational Services Index,192.3,110.98,215.97,73.2744638673635,51.99516324062877,游댮,FUERTE,250,2025-10-27 07:44:22
DJUSRR,Dow Jones U.S. Railroads Index,3341.9,2788.9,3607.9,19.828606260532826,77.38364779874217,游리,CERCA,250,2025-10-27 07:44:22
DJUSRS,Dow Jones U.S. Specialty Retailers Index,4379.8,3308.6,4908.8,32.376231638759606,65.43873113328216,游댮,FUERTE,250,2025-10-27 07:44:22
DJUSRT,Dow Jones U.S. Retail Index,3098.3,2453.4,3267.5,26.285970489932343,48.17021276595744,游댮,FUERTE,250,2025-10-27 07:44:22
DJUSRU,Dow Jones U.S. Restaurants & Bars Index,2983.5,2686.2,3265.8,11.06767924949744,48.34384858044163,游리,CERCA,250,2025-10-27 07:44:22
DJUSSB,Dow Jones U.S. Investment Services Index,3016.1,2060.8,3066.3,46.35578416149067,49.93921711646,游댮,FUERTE,250,2025-10-27 07:44:22
DJUSSC,Dow Jones U.S. Semiconductors Index,28194.3,12938.1,28545.8,117.91685023303266,45.08853551836679,游댮,FUERTE,250,2025-10-27 07:44:22
DJUSSD,Dow Jones U.S. Soft Drinks Index,937.86,835.84,972.52,12.205685298621743,25.34387895460793,游리,CERCA,250,2025-10-27 07:44:22
DJUSSF,Dow Jones U.S. Consumer Finance Index,802.07,619.26,809.9,29.52071827665279,46.053860523038566,游댮,FUERTE,250,2025-10-27 07:44:22
DJUSSP,Dow Jones U.S. Specialty Finance Index,732.44,663.1,803.35,10.456944653898361,58.35439483291213,游리,CERCA,250,2025-10-27 07:44:22
DJUSSR,Dow Jones U.S. Specialty REITs Index,267.3,229.18,287.27,16.63321406754516,34.249471458773655,游리,CERCA,250,2025-10-27 07:44:22
DJUSST,Dow Jones U.S. Iron & Steel Index,606.94,416.26,642.02,45.80790851871428,43.30773450356552,游댮,FUERTE,250,2025-10-27 07:44:22
DJUSSV,Dow Jones U.S. Software & Computer Services Index,8679.3,5509.7,8710.2,57.52763308347097,44.6898803046791,游댮,FUERTE,250,2025-10-27 07:44:22
DJUSSW,Dow Jones U.S. Software Index,8724.3,5758.2,8972.9,51.51088881942273,52.234604105571854,游댮,FUERTE,250,2025-10-27 07:44:22
DJUSTB,Dow Jones U.S. Tobacco Index,1096.98,824.94,1210.02,32.97694377772928,45.04543487667678,游댮,FUERTE,250,2025-10-27 07:44:22
DJUSTC,Dow Jones U.S. Technology Index,8833.4,5115.5,8862.5,72.67911250122177,44.31038219781808,游댮,FUERTE,250,2025-10-27 07:44:22
DJUSTK,Dow Jones U.S. Trucking Index,1380.87,1244.48,2071.67,10.959597582926191,50.70961491886657,游리,CERCA,250,2025-10-27 07:44:22
DJUSTL,Dow Jones U.S. Telecommunications Index,168.9,155.76,199.75,8.436055469953786,65.99118942731272,游릭,OPORTUNIDAD,250,2025-10-27 07:44:22
DJUSTQ,Dow Jones U.S. Technology Hardware & Equipment Index,10068.2,5326.7,10109.6,89.01383595847338,44.26276672260847,游댮,FUERTE,250,2025-10-27 07:44:22
DJUSTR,Dow Jones U.S. Tires Index,10068.2,5326.7,10109.6,89.01383595847338,44.26276672260847,游댮,FUERTE,250,2025-10-27 07:44:22
DJUSTT,Dow Jones U.S. Travel & Tourism Index,1345.63,957.74,1432.9,40.50055338609644,62.67089729830615,游댮,FUERTE,250,2025-10-27 07:44:22
DJUSTY,Dow Jones U.S. Toys Index,1960.5,1122.95,2066.13,74.58479896700653,47.88876276958001,游댮,FUERTE,250,2025-10-27 07:44:22
DJUSUT,Dow Jones U.S. Utilities Index,454.01,353.79,466.02,28.327538935526714,40.96679687500003,游댮,FUERTE,250,2025-10-27 07:44:22
DJUSVE,Dow Jones U.S. Conventional Electricity Index,458.24,341.92,472.89,34.019653720168456,41.559149554788284,游댮,FUERTE,250,2025-10-27 07:44:22
DJUSVN,Dow Jones U.S. Distillers & Vintners Index,284.06,268.56,492.24,5.7715221924337206,46.27488760436737,游릭,OPORTUNIDAD,250,2025-10-27 07:44:22
DJUSWC,Dow Jones U.S. Mobile Telecommunications Index,372.77,360.57,458.56,3.383531630473969,69.94448850118951,游릭,OPORTUNIDAD,250,2025-10-27 07:44:22
DJUSWU,Dow Jones U.S. Water Index,2935.7,2432.7,3135.8,20.676614461298147,41.98824431382573,游리,CERCA,250,2025-10-27 07:44:22
