Ticker,Sector,CurrentPrice,Min52w,Max52w,DistanceFromMin,RSI,Estado,Classification,DataPoints,AnalysisDate
DJUSFR,Dow Jones U.S. Forestry & Paper Index,777.78,703.58,931.38,10.546064413428455,62.28796445880454,游리,CERCA,251,2025-10-30 07:43:20
DJUSAE,Dow Jones U.S. Aerospace & Defense Index,2953.8,1861.2,3004.0,58.70406189555126,40.96303057964396,游댮,FUERTE,251,2025-10-30 07:43:20
DJUSAF,Dow Jones U.S. Delivery Services Index,1100.4,916.9,1383.0,20.013087577707505,28.915662650602428,游리,CERCA,251,2025-10-30 07:43:20
DJUSAG,Dow Jones U.S. Asset Managers Index,380.24,273.77,426.58,38.89030938378932,59.89713833575104,游댮,FUERTE,251,2025-10-30 07:43:20
DJUSAI,Dow Jones U.S. Electronic Equipment Index,1829.1,913.78,1854.08,100.1685307185537,37.70444845464179,游댮,FUERTE,251,2025-10-30 07:43:20
DJUSAL,Dow Jones U.S. Aluminum Index,132.92,73.62,163.19,80.54876392284702,45.03502893694794,游댮,FUERTE,251,2025-10-30 07:43:20
DJUSAM,Dow Jones U.S. Medical Equipment Index,2948.3,2589.3,3151.1,13.864751091028463,44.62421711899787,游리,CERCA,251,2025-10-30 07:43:20
DJUSAP,Dow Jones U.S. Automobiles & Parts Index,1710.7,845.49,1748.7,102.33237530899243,38.071802780486685,游댮,FUERTE,251,2025-10-30 07:43:20
DJUSAR,Dow Jones U.S. Airlines Index,223.4,137.83,259.72,62.08372632953637,53.65067079463364,游댮,FUERTE,251,2025-10-30 07:43:20
DJUSAS,Dow Jones U.S. Aerospace Index,3202.0,1883.9,3261.9,69.96655873454004,34.6532663316583,游댮,FUERTE,251,2025-10-30 07:43:20
DJUSAT,Dow Jones U.S. Auto Parts Index,419.05,288.25,447.84,45.37727666955768,51.225712729253644,游댮,FUERTE,251,2025-10-30 07:43:20
DJUSAU,Dow Jones U.S. Automobiles Index,1566.65,758.25,1613.6,106.61391361688099,38.00493663074949,游댮,FUERTE,251,2025-10-30 07:43:20
DJUSAV,Dow Jones U.S. Media Agencies Index,417.76,346.44,702.93,20.586537351345108,56.273838630806836,游리,CERCA,251,2025-10-30 07:43:20
DJUSBC,Dow Jones U.S. Broadcasting & Entertainment Index,1170.7,962.0,1294.9,21.6943866943867,52.82663316582914,游리,CERCA,251,2025-10-30 07:43:20
DJUSBD,Dow Jones U.S. Building Materials & Fixtures Index,2408.7,1876.9,2557.1,28.333954925675297,45.69240587109126,游댮,FUERTE,251,2025-10-30 07:43:20
DJUSBE,Dow Jones U.S. Business Training & Employment Agencies Index,101.73,101.49,152.72,0.23647650014780677,73.22551662174303,游릭,OPORTUNIDAD,251,2025-10-30 07:43:20
DJUSBK,Dow Jones U.S. Banks Index,766.33,521.55,799.76,46.93317994439653,47.319161285641734,游댮,FUERTE,251,2025-10-30 07:43:20
DJUSBS,Dow Jones U.S. Basic Resources Index,446.91,274.91,478.98,62.565930668218684,52.96129220023282,游댮,FUERTE,251,2025-10-30 07:43:20
DJUSBT,Dow Jones U.S. Biotechnology Index,2996.5,2297.4,3068.1,30.430051362409678,38.505244755244796,游댮,FUERTE,251,2025-10-30 07:43:20
DJUSBV,Dow Jones U.S. Beverages Index,932.31,875.4,1013.26,6.501028101439339,45.8473845188613,游릭,OPORTUNIDAD,251,2025-10-30 07:43:20
DJUSCA,Dow Jones U.S. Gambling Index,631.62,513.6,786.57,22.978971962616818,59.04794638253992,游리,CERCA,251,2025-10-30 07:43:20
DJUSCC,Dow Jones U.S. Commodity Chemicals Index,670.88,647.09,825.24,3.6764592251464188,68.27118644067801,游릭,OPORTUNIDAD,251,2025-10-30 07:43:20
DJUSCH,Dow Jones U.S. Chemicals Index,1905.61,1497.87,2050.51,27.221320942404887,52.584419141526794,游댮,FUERTE,251,2025-10-30 07:43:20
DJUSCM,Dow Jones U.S. Personal Products Index,360.16,345.1,458.91,4.363952477542742,66.54370324828363,游릭,OPORTUNIDAD,251,2025-10-30 07:43:20
DJUSCN,Dow Jones U.S. Construction & Materials Index,2107.06,1484.39,2140.56,41.947870842568314,40.731945348080664,游댮,FUERTE,251,2025-10-30 07:43:20
DJUSCP,Dow Jones U.S. Containers & Packaging Index,410.68,397.01,541.01,3.443238205586765,59.570790724470704,游릭,OPORTUNIDAD,251,2025-10-30 07:43:20
DJUSCR,Dow Jones U.S. Computer Hardware Index,13645.6,8364.8,13709.7,63.13121652639635,33.42012430707207,游댮,FUERTE,251,2025-10-30 07:43:20
DJUSCS,Dow Jones U.S. Specialized Consumer Services Index,2551.9,2549.8,3402.3,0.08235940073730916,69.41457586618876,游릭,OPORTUNIDAD,251,2025-10-30 07:43:20
DJUSCT,Dow Jones U.S. Telecommunications Equipment Index,2738.34,1708.47,2771.34,60.28025075067166,49.67832730197023,游댮,FUERTE,251,2025-10-30 07:43:20
DJUSCX,Dow Jones U.S. Specialty Chemicals Index,1028.78,863.05,1195.08,19.20282718266613,54.73056504981456,游리,CERCA,251,2025-10-30 07:43:20
DJUSDB,Dow Jones U.S. Brewers Index,444.18,443.77,659.78,0.09239020213174055,70.68741893644618,游릭,OPORTUNIDAD,251,2025-10-30 07:43:20
DJUSDN,Dow Jones U.S. Defense Index,819.51,598.11,850.34,37.01660229723629,58.822990191584935,游댮,FUERTE,251,2025-10-30 07:43:20
DJUSDR,Dow Jones U.S. Food & Drug Retailers Index,1557.87,1264.81,1615.62,23.170278539859737,47.449945887445885,游리,CERCA,251,2025-10-30 07:43:20
DJUSDS,Dow Jones U.S. Industrial Suppliers Index,922.24,683.22,994.97,34.98433886595825,62.61709817806299,游댮,FUERTE,251,2025-10-30 07:43:20
DJUSDT,Dow Jones U.S. Diversified REITs Index,56.98,45.49,60.0,25.25829852714881,57.024793388429764,游댮,FUERTE,251,2025-10-30 07:43:20
DJUSDV,Dow Jones U.S. Computer Services Index,299.14,231.08,306.75,29.453003288904263,34.13290689410097,游댮,FUERTE,251,2025-10-30 07:43:20
DJUSEC,Dow Jones U.S. Electrical Components & Equipment Index,1075.64,562.61,1081.79,91.18750111089389,41.335722588144094,游댮,FUERTE,251,2025-10-30 07:43:20
DJUSEE,Dow Jones U.S. Electronic & Electrical Equipment Index,1249.38,643.85,1258.23,94.04830317620565,39.77302374119483,游댮,FUERTE,251,2025-10-30 07:43:20
DJUSEH,Dow Jones U.S. Real Estate Holding & Development Index,68.56,50.8,72.61,34.96062992125986,24.62825278810412,游댮,FUERTE,223,2025-10-30 07:43:20
DJUSEN,Dow Jones U.S. Oil & Gas Index,741.97,623.85,813.7,18.93403863108119,49.680872966851965,游리,CERCA,251,2025-10-30 07:43:20
DJUSES,Dow Jones U.S. Real Estate Services Index,334.2,268.15,392.49,24.631735968674256,54.903166308023366,游리,CERCA,251,2025-10-30 07:43:20
DJUSEU,Dow Jones U.S. Electricity Index,452.97,340.99,471.47,32.839672717675015,50.9858692080184,游댮,FUERTE,251,2025-10-30 07:43:20
DJUSFA,Dow Jones U.S. Financial Administration Index,497.05,495.54,685.16,0.30471808532106204,75.21497602922155,游릭,OPORTUNIDAD,251,2025-10-30 07:43:20
DJUSFB,Dow Jones U.S. Food & Beverage Index,688.29,668.77,770.54,2.9187912137207084,51.29282893898872,游릭,OPORTUNIDAD,251,2025-10-30 07:43:20
DJUSFC,Dow Jones U.S. Fixed Line Telecommunications Index,149.72,127.84,175.95,17.115143929912385,60.01491980604253,游리,CERCA,251,2025-10-30 07:43:20
DJUSFD,Dow Jones U.S. Food Retailers & Wholesalers Index,1193.19,1080.44,1346.72,10.435563289030394,60.88392680187621,游리,CERCA,251,2025-10-30 07:43:20
DJUSFE,Dow Jones U.S. Industrial Machinery Index,1273.65,969.18,1325.15,31.415216987556505,39.11498528676919,游댮,FUERTE,251,2025-10-30 07:43:20
DJUSFH,Dow Jones U.S. Furnishings Index,457.29,319.67,507.6,43.0506459786655,57.37531419499933,游댮,FUERTE,251,2025-10-30 07:43:20
DJUSFI,Dow Jones U.S. Financial Services Index,2424.6,1907.9,2532.3,27.082132187221543,56.362545018007225,游댮,FUERTE,251,2025-10-30 07:43:20
DJUSFO,Dow Jones U.S. Food Producers Index,361.74,359.82,431.28,0.5336001334000378,63.84953590620417,游릭,OPORTUNIDAD,251,2025-10-30 07:43:20
DJUSFP,Dow Jones U.S. Food Products Index,501.77,498.48,625.15,0.6600064195153192,66.35594435680488,游릭,OPORTUNIDAD,251,2025-10-30 07:43:20
DJUSFT,Dow Jones U.S. Footwear Index,1381.6,1186.7,1942.6,16.423695963596515,61.70409104890804,游리,CERCA,251,2025-10-30 07:43:20
DJUSGF,Dow Jones U.S. Financial Services Index,2717.7,2138.5,2838.4,27.084404956745374,56.36217519421375,游댮,FUERTE,251,2025-10-30 07:43:20
DJUSGI,Dow Jones U.S. General Industrials Index,704.68,613.23,783.86,14.912838576064432,44.85354401132893,游리,CERCA,251,2025-10-30 07:43:20
DJUSGT,Dow Jones U.S. General Retailers Index,3463.3,2720.3,3649.5,27.313163989265888,53.00146412884334,游댮,FUERTE,251,2025-10-30 07:43:20
DJUSGU,Dow Jones U.S. Gas Distribution Index,376.87,304.15,390.51,23.909255301660377,56.76756139348945,游리,CERCA,251,2025-10-30 07:43:20
DJUSHB,Dow Jones U.S. Home Construction Index,2468.42,1872.38,2981.07,31.833281705636672,50.162137985016194,游댮,FUERTE,251,2025-10-30 07:43:20
DJUSHC,Dow Jones U.S. Health Care Index,1536.57,1344.15,1597.65,14.315366588550374,51.6526837157586,游리,CERCA,251,2025-10-30 07:43:20
DJUSHD,Dow Jones U.S. Durable Household Products Index,114.77,94.51,179.28,21.436884985715785,40.93725793958173,游리,CERCA,251,2025-10-30 07:43:20
DJUSHG,Dow Jones U.S. Household Goods & Home Construction Index,1001.73,999.49,1216.79,0.2241142982921299,58.020063940028635,游릭,OPORTUNIDAD,251,2025-10-30 07:43:20
DJUSHI,Dow Jones U.S. Home Improvement Retailers Index,833.36,705.04,958.3,18.20038579371384,45.22106631989593,游리,CERCA,251,2025-10-30 07:43:20
DJUSHL,Dow Jones U.S. Hotel & Lodging REITs Index,86.78,65.02,103.03,33.466625653645046,47.92746113989637,游댮,FUERTE,251,2025-10-30 07:43:20
DJUSHN,Dow Jones U.S. Nondurable Household Products Index,1142.47,1140.46,1420.24,0.17624467320204049,59.46940522036793,游릭,OPORTUNIDAD,251,2025-10-30 07:43:20
DJUSHP,Dow Jones U.S. Health Care Providers Index,2716.3,2106.6,3422.4,28.9423715940378,55.3213545266067,游댮,FUERTE,251,2025-10-30 07:43:20
DJUSHR,Dow Jones U.S. Commercial Vehicles & Trucks Index,6167.8,3916.0,6235.5,57.50255362614914,29.525845009103108,游댮,FUERTE,251,2025-10-30 07:43:20
DJUSHV,Dow Jones U.S. Heavy Construction Index,2378.39,1138.85,2402.18,108.8413750713439,34.45010550151818,游댮,FUERTE,251,2025-10-30 07:43:20
DJUSIB,Dow Jones U.S. Insurance Brokers Index,679.43,677.41,891.38,0.29819459411582083,83.00527371313967,游릭,OPORTUNIDAD,251,2025-10-30 07:43:20
DJUSID,Dow Jones U.S. Diversified Industrials Index,948.84,767.22,1017.95,23.67247986236021,37.824691117812996,游리,CERCA,251,2025-10-30 07:43:20
DJUSIG,Dow Jones U.S. Industrial Goods & Services Index,1490.65,1094.74,1511.78,36.16475144783237,46.50253359770873,游댮,FUERTE,251,2025-10-30 07:43:20
DJUSIL,Dow Jones U.S. Life Insurance Index,1236.46,1077.94,1380.29,14.705827782622407,62.71406491499222,游리,CERCA,251,2025-10-30 07:43:20
DJUSIM,Dow Jones U.S. Industrial Metals & Mining Index,539.91,350.58,568.14,54.00479205887386,43.06049822064059,游댮,FUERTE,251,2025-10-30 07:43:20
DJUSIO,Dow Jones U.S. Industrial & Office REITs Index,107.55,79.12,111.84,35.93276036400403,38.17583450869768,游댮,FUERTE,251,2025-10-30 07:43:20
DJUSIP,Dow Jones U.S. Property & Casualty Insurance Index,1821.12,1755.13,2065.57,3.7598354537840377,75.23806139852185,游릭,OPORTUNIDAD,251,2025-10-30 07:43:20
DJUSIQ,Dow Jones U.S. Industrial Engineering Index,4775.3,3318.0,4822.3,43.92103676913804,31.353353618203357,游댮,FUERTE,251,2025-10-30 07:43:20
DJUSIR,Dow Jones U.S. Insurance Index,1255.34,1251.2,1458.0,0.3308823529411663,77.97628542563938,游릭,OPORTUNIDAD,251,2025-10-30 07:43:20
DJUSIS,Dow Jones U.S. Support Services Index,781.46,764.29,981.89,2.2465294587133253,71.52433692800929,游릭,OPORTUNIDAD,251,2025-10-30 07:43:20
DJUSIT,Dow Jones U.S. Industrial Transportation Index,1458.8,1243.5,1746.8,17.314032971451546,52.2262334536703,游리,CERCA,251,2025-10-30 07:43:20
DJUSIU,Dow Jones U.S. Reinsurance Index,501.14,467.58,599.38,7.177381410667694,67.2812830116201,游릭,OPORTUNIDAD,251,2025-10-30 07:43:20
DJUSIV,Dow Jones U.S. Business Support Services Index,1086.39,1072.64,1443.42,1.2818839498806682,60.63471710209967,游릭,OPORTUNIDAD,251,2025-10-30 07:43:20
DJUSIX,Dow Jones U.S. Nonlife Insurance Index,1233.77,1229.49,1458.15,0.34811181872158153,79.09223569667391,游릭,OPORTUNIDAD,251,2025-10-30 07:43:20
DJUSLE,Dow Jones U.S. Leisure Goods Index,1205.91,724.03,1249.95,66.55525323536318,42.51139120658022,游댮,FUERTE,251,2025-10-30 07:43:20
DJUSLG,Dow Jones U.S. Hotels Index,4111.3,3245.4,4663.6,26.680840574351393,52.17115286947688,游댮,FUERTE,251,2025-10-30 07:43:20
DJUSMC,Dow Jones U.S. Health Care Equipment & Services Index,2331.0,2083.0,2553.7,11.905904944791166,47.513141932875016,游리,CERCA,251,2025-10-30 07:43:20
DJUSME,Dow Jones U.S. Media Index,802.89,662.35,936.97,21.218389069223214,53.38563875149243,游리,CERCA,251,2025-10-30 07:43:20
DJUSMF,Dow Jones U.S. Mortgage Finance Index,11.76,9.98,13.76,17.835671342685362,50.678733031674184,游리,CERCA,251,2025-10-30 07:43:20
DJUSMG,Dow Jones U.S. Mining Index,182.03,84.25,223.28,116.0593471810089,57.408212035628935,游댮,FUERTE,251,2025-10-30 07:43:20
DJUSMR,Dow Jones U.S. Mortgage REITs Index,29.95,24.64,32.68,21.55032467532467,51.08695652173915,游리,CERCA,251,2025-10-30 07:43:20
DJUSMS,Dow Jones U.S. Medical Supplies Index,1748.56,1472.69,1772.57,18.732387671539826,29.506569343065735,游리,CERCA,251,2025-10-30 07:43:20
DJUSMT,Dow Jones U.S. Marine Transportation Index,331.5,261.01,433.97,27.006628098540293,12.075788463844631,游댮,FUERTE,251,2025-10-30 07:43:20
DJUSMU,Dow Jones U.S. Multiutilities Index,288.28,249.55,299.75,15.51993588459225,55.08283132530127,游리,CERCA,251,2025-10-30 07:43:20
DJUSNF,Dow Jones U.S. Nonferrous Metals Index,564.37,372.55,658.01,51.48839082002416,55.4369918699187,游댮,FUERTE,251,2025-10-30 07:43:20
DJUSNG,Dow Jones U.S. Personal & Household Goods Index,992.82,909.61,1081.16,9.147876562482827,65.93989393046547,游릭,OPORTUNIDAD,251,2025-10-30 07:43:20
DJUSNS,Dow Jones U.S. Internet Index,6834.8,3842.4,6853.4,77.87840932750363,26.59310580788643,游댮,FUERTE,251,2025-10-30 07:43:20
DJUSOG,Dow Jones U.S. Oil & Gas Producers,845.12,707.01,914.32,19.534377165810955,47.6939726939727,游리,CERCA,251,2025-10-30 07:43:20
DJUSOI,Dow Jones U.S. Oil Equipment & Services Index,274.12,198.86,294.15,37.84572060746253,32.30567399147262,游댮,FUERTE,251,2025-10-30 07:43:20
DJUSOL,Dow Jones U.S. Integrated Oil & Gas Index,758.4,645.42,806.96,17.504880542902303,40.17826920907144,游리,CERCA,251,2025-10-30 07:43:20
DJUSOS,Dow Jones U.S. Exploration & Production Index,1006.06,821.29,1123.35,22.49753436666707,54.815362671033874,游리,CERCA,251,2025-10-30 07:43:20
DJUSPB,Dow Jones U.S. Publishing Index,770.82,663.16,874.35,16.234392906689198,49.15916627190901,游리,CERCA,251,2025-10-30 07:43:20
DJUSPC,Dow Jones U.S. Waste & Disposal Services Index,603.84,601.24,708.03,0.4324396247754678,76.55695003551988,游릭,OPORTUNIDAD,251,2025-10-30 07:43:20
DJUSPG,Sector PG,487.49,426.49,649.12,14.302797251987151,62.217860647693826,游리,CERCA,251,2025-10-30 07:43:20
DJUSPL,Dow Jones U.S. Pipelines Index,968.54,925.07,1229.95,4.69910385160041,76.5610056018582,游릭,OPORTUNIDAD,251,2025-10-30 07:43:20
DJUSPM,Dow Jones U.S. Gold Mining Index,206.32,94.85,251.35,117.52240379546652,56.917328351237735,游댮,FUERTE,251,2025-10-30 07:43:20
DJUSPN,Dow Jones U.S. Pharmaceuticals & Biotechnology Index,1186.78,960.01,1211.74,23.62162894136519,56.52720981440705,游리,CERCA,251,2025-10-30 07:43:20
DJUSPR,Dow Jones U.S. Pharmaceuticals Index,898.27,765.56,963.2,17.335022728460217,70.97966728280963,游리,CERCA,251,2025-10-30 07:43:20
DJUSRA,Dow Jones U.S. Apparel Retailers Index,1885.63,1490.78,1923.54,26.486134775084192,34.53197661034113,游댮,FUERTE,251,2025-10-30 07:43:20
DJUSRB,Dow Jones U.S. Broadline Retailers Index,4810.0,3641.4,5034.6,32.092052507277415,47.349593495934926,游댮,FUERTE,251,2025-10-30 07:43:20
DJUSRD,Dow Jones U.S. Drug Retailers Index,1281.4,860.93,1290.8,48.83904614777045,23.14911366006251,游댮,FUERTE,251,2025-10-30 07:43:20
DJUSRE,Dow Jones U.S. Real Estate Index,357.12,311.91,396.19,14.494565740117334,53.589916722934944,游리,CERCA,251,2025-10-30 07:43:20
DJUSRH,Dow Jones U.S. Real Estate Investment & Services,700.87,563.1,822.79,24.466347007636294,54.90727845781719,游리,CERCA,251,2025-10-30 07:43:20
DJUSRI,Dow Jones U.S. Real Estate Investment Trusts Index,144.29,126.8,161.13,13.793375394321764,53.240223463687144,游리,CERCA,251,2025-10-30 07:43:20
DJUSRL,Dow Jones U.S. Retail REITs Index,98.73,83.32,106.33,18.49495919347097,55.869373345101494,游리,CERCA,251,2025-10-30 07:43:20
DJUSRN,Dow Jones U.S. Residential REITs Index,207.27,206.56,264.7,0.34372579395817576,70.47413793103449,游릭,OPORTUNIDAD,251,2025-10-30 07:43:20
DJUSRP,Dow Jones U.S. Recreational Products Index,344.7,305.34,496.77,12.890548241304781,61.717325227963535,游리,CERCA,251,2025-10-30 07:43:20
DJUSRQ,Dow Jones U.S. Recreational Services Index,176.61,110.98,215.97,59.136781402054424,61.73469387755101,游댮,FUERTE,251,2025-10-30 07:43:20
DJUSRR,Dow Jones U.S. Railroads Index,3317.3,2788.9,3607.9,18.946538061601352,74.21451787648971,游리,CERCA,251,2025-10-30 07:43:20
DJUSRS,Dow Jones U.S. Specialty Retailers Index,4359.3,3308.6,4908.8,31.75663422595661,73.96544797107273,游댮,FUERTE,251,2025-10-30 07:43:20
DJUSRT,Dow Jones U.S. Retail Index,3107.9,2453.4,3267.5,26.677264204777046,52.85513361462725,游댮,FUERTE,251,2025-10-30 07:43:20
DJUSRU,Dow Jones U.S. Restaurants & Bars Index,2950.1,2686.2,3265.8,9.824287097014373,45.66317921025991,游릭,OPORTUNIDAD,251,2025-10-30 07:43:20
DJUSSB,Dow Jones U.S. Investment Services Index,2982.4,2060.8,3066.3,44.720496894409926,55.07748776508969,游댮,FUERTE,251,2025-10-30 07:43:20
DJUSSC,Dow Jones U.S. Semiconductors Index,30653.7,12938.1,31044.1,136.92582372991396,35.99176954732512,游댮,FUERTE,251,2025-10-30 07:43:20
DJUSSD,Dow Jones U.S. Soft Drinks Index,913.18,835.84,972.52,9.252967075038274,44.25984251968505,游릭,OPORTUNIDAD,251,2025-10-30 07:43:20
DJUSSF,Dow Jones U.S. Consumer Finance Index,786.26,619.26,809.9,26.967671091302524,48.12134277794888,游댮,FUERTE,251,2025-10-30 07:43:20
DJUSSP,Dow Jones U.S. Specialty Finance Index,709.85,663.1,803.35,7.050218669883879,67.4412945613822,游릭,OPORTUNIDAD,251,2025-10-30 07:43:20
DJUSSR,Dow Jones U.S. Specialty REITs Index,255.26,229.18,287.27,11.379701544637395,55.70247933884296,游리,CERCA,251,2025-10-30 07:43:20
DJUSST,Dow Jones U.S. Iron & Steel Index,650.48,416.26,655.87,56.26771729207708,36.49812193007801,游댮,FUERTE,251,2025-10-30 07:43:20
DJUSSV,Dow Jones U.S. Software & Computer Services Index,8893.6,5509.7,8975.6,61.41713704920414,31.26684636118604,游댮,FUERTE,251,2025-10-30 07:43:20
DJUSSW,Dow Jones U.S. Software Index,8855.6,5758.2,9040.0,53.79111527908028,42.70900149668595,游댮,FUERTE,251,2025-10-30 07:43:20
DJUSTB,Dow Jones U.S. Tobacco Index,1030.59,824.94,1210.02,24.929085751691012,66.66177693022347,游리,CERCA,251,2025-10-30 07:43:20
DJUSTC,Dow Jones U.S. Technology Index,9238.7,5115.5,9259.3,80.60209168214251,33.850563968342996,游댮,FUERTE,251,2025-10-30 07:43:20
DJUSTK,Dow Jones U.S. Trucking Index,1371.24,1244.48,2071.67,10.185780406274105,54.78764478764479,游리,CERCA,251,2025-10-30 07:43:20
DJUSTL,Dow Jones U.S. Telecommunications Index,170.58,155.76,199.75,9.514637904468428,61.451342281879135,游릭,OPORTUNIDAD,251,2025-10-30 07:43:20
DJUSTQ,Dow Jones U.S. Technology Hardware & Equipment Index,10722.4,5326.7,10826.1,101.29536110537481,35.23540109112956,游댮,FUERTE,251,2025-10-30 07:43:20
DJUSTR,Dow Jones U.S. Tires Index,10722.4,5326.7,10826.1,101.29536110537481,35.23540109112956,游댮,FUERTE,251,2025-10-30 07:43:20
DJUSTT,Dow Jones U.S. Travel & Tourism Index,1345.21,957.74,1432.9,40.45670014826571,50.88293605053251,游댮,FUERTE,251,2025-10-30 07:43:20
DJUSTY,Dow Jones U.S. Toys Index,1997.13,1137.88,2066.13,75.51323513903047,41.71044048477355,游댮,FUERTE,251,2025-10-30 07:43:20
DJUSUT,Dow Jones U.S. Utilities Index,447.58,353.79,466.02,26.51007659911246,53.18857142857145,游댮,FUERTE,251,2025-10-30 07:43:20
DJUSVE,Dow Jones U.S. Conventional Electricity Index,454.31,341.92,472.89,32.87026204960224,50.990666448337954,游댮,FUERTE,251,2025-10-30 07:43:20
DJUSVN,Dow Jones U.S. Distillers & Vintners Index,268.03,267.64,489.82,0.14571812882976626,75.03766951280767,游릭,OPORTUNIDAD,251,2025-10-30 07:43:20
DJUSWC,Dow Jones U.S. Mobile Telecommunications Index,379.04,360.57,458.56,5.122445017611012,60.95256839204879,游릭,OPORTUNIDAD,251,2025-10-30 07:43:20
DJUSWU,Dow Jones U.S. Water Index,2724.3,2432.7,3135.8,11.986681465038862,68.28082458187475,游리,CERCA,251,2025-10-30 07:43:20
