Ticker,Sector,CurrentPrice,Min52w,Max52w,DistanceFromMin,RSI,Estado,Classification,DataPoints,AnalysisDate
DJUSFR,Dow Jones U.S. Forestry & Paper Index,789.08,703.58,886.08,12.152136217629836,12.989864864864629,游리,CERCA,250,2025-12-29 07:51:06
DJUSAE,Dow Jones U.S. Aerospace & Defense Index,2970.4,1861.2,3004.0,59.5959595959596,27.317798710956836,游댮,FUERTE,250,2025-12-29 07:51:06
DJUSAF,Dow Jones U.S. Delivery Services Index,1243.8,916.9,1315.0,35.65274293816119,13.612004287245497,游댮,FUERTE,249,2025-12-29 07:51:06
DJUSAG,Dow Jones U.S. Asset Managers Index,400.82,273.77,426.58,46.40756839682946,37.271062271062284,游댮,FUERTE,250,2025-12-29 07:51:06
DJUSAI,Dow Jones U.S. Electronic Equipment Index,1874.13,913.78,1932.6,105.09641270327651,51.789746214287845,游댮,FUERTE,250,2025-12-29 07:51:06
DJUSAL,Dow Jones U.S. Aluminum Index,185.33,73.62,185.91,151.7386579733768,18.317863231672646,游댮,FUERTE,250,2025-12-29 07:51:06
DJUSAM,Dow Jones U.S. Medical Equipment Index,3010.5,2589.3,3151.1,16.26694473409801,44.394110985277365,游리,CERCA,250,2025-12-29 07:51:06
DJUSAP,Dow Jones U.S. Automobiles & Parts Index,1774.17,845.49,1853.16,109.8392648050243,34.20227849360727,游댮,FUERTE,250,2025-12-29 07:51:06
DJUSAR,Dow Jones U.S. Airlines Index,261.52,137.83,268.82,89.7409852717115,37.06650346797232,游댮,FUERTE,250,2025-12-29 07:51:06
DJUSAS,Dow Jones U.S. Aerospace Index,3281.0,1883.9,3315.4,74.15998726047029,26.091391268869856,游댮,FUERTE,250,2025-12-29 07:51:06
DJUSAT,Dow Jones U.S. Auto Parts Index,410.92,288.25,447.84,42.556808326105816,46.47022713321058,游댮,FUERTE,249,2025-12-29 07:51:06
DJUSAU,Dow Jones U.S. Automobiles Index,1628.92,758.25,1704.26,114.82624464226838,34.37086608046067,游댮,FUERTE,250,2025-12-29 07:51:06
DJUSAV,Dow Jones U.S. Media Agencies Index,369.45,346.44,656.63,6.641842743332176,41.291108404384914,游릭,OPORTUNIDAD,250,2025-12-29 07:51:06
DJUSBC,Dow Jones U.S. Broadcasting & Entertainment Index,1242.3,962.0,1294.9,29.137214137214134,16.58075601374594,游댮,FUERTE,250,2025-12-29 07:51:06
DJUSBD,Dow Jones U.S. Building Materials & Fixtures Index,2385.7,1876.9,2514.3,27.108530022910106,42.346938775510196,游댮,FUERTE,250,2025-12-29 07:51:06
DJUSBE,Dow Jones U.S. Business Training & Employment Agencies Index,99.32,95.19,143.02,4.338691038974678,46.21848739495801,游릭,OPORTUNIDAD,250,2025-12-29 07:51:06
DJUSBK,Dow Jones U.S. Banks Index,849.8,521.55,855.22,62.937398140159154,28.351340536214508,游댮,FUERTE,250,2025-12-29 07:51:06
DJUSBS,Dow Jones U.S. Basic Resources Index,546.31,274.91,548.68,98.72321850787526,15.919955530850558,游댮,FUERTE,249,2025-12-29 07:51:06
DJUSBT,Dow Jones U.S. Biotechnology Index,3194.8,2297.4,3252.2,39.06154783668495,37.71076523994811,游댮,FUERTE,250,2025-12-29 07:51:06
DJUSBV,Dow Jones U.S. Beverages Index,949.78,875.4,1013.26,8.496687228695453,53.87487126673532,游릭,OPORTUNIDAD,250,2025-12-29 07:51:06
DJUSCA,Dow Jones U.S. Gambling Index,671.96,513.6,786.57,30.833333333333336,42.252456538170826,游댮,FUERTE,250,2025-12-29 07:51:06
DJUSCC,Dow Jones U.S. Commodity Chemicals Index,657.94,608.9,794.88,8.053867630152748,37.10298363811355,游릭,OPORTUNIDAD,249,2025-12-29 07:51:06
DJUSCH,Dow Jones U.S. Chemicals Index,1951.89,1497.87,2050.51,30.31104167918446,31.32277901347632,游댮,FUERTE,250,2025-12-29 07:51:06
DJUSCM,Dow Jones U.S. Personal Products Index,390.47,341.42,452.45,14.366469451115929,33.21854304635757,游리,CERCA,250,2025-12-29 07:51:06
DJUSCN,Dow Jones U.S. Construction & Materials Index,2052.68,1484.39,2140.56,38.28441312593049,48.30168158621268,游댮,FUERTE,250,2025-12-29 07:51:06
DJUSCP,Dow Jones U.S. Containers & Packaging Index,422.23,388.62,514.38,8.648551284030676,27.70633621697455,游릭,OPORTUNIDAD,250,2025-12-29 07:51:06
DJUSCR,Dow Jones U.S. Computer Hardware Index,13763.0,8364.8,14401.2,64.53471690895182,60.50858715248128,游댮,FUERTE,250,2025-12-29 07:51:06
DJUSCS,Dow Jones U.S. Specialized Consumer Services Index,2378.9,2326.4,3402.3,2.2567056396148555,40.45368620037792,游릭,OPORTUNIDAD,250,2025-12-29 07:51:06
DJUSCT,Dow Jones U.S. Telecommunications Equipment Index,2745.48,1708.47,2800.11,60.69816853676095,42.66863167441331,游댮,FUERTE,249,2025-12-29 07:51:06
DJUSCX,Dow Jones U.S. Specialty Chemicals Index,1082.84,863.05,1135.86,25.46665894212386,25.891662951404257,游댮,FUERTE,250,2025-12-29 07:51:06
DJUSDB,Dow Jones U.S. Brewers Index,473.89,438.36,659.78,8.10521032940961,51.500000000000014,游릭,OPORTUNIDAD,250,2025-12-29 07:51:06
DJUSDN,Dow Jones U.S. Defense Index,786.28,598.11,850.34,31.460768086137993,34.19648810846857,游댮,FUERTE,250,2025-12-29 07:51:06
DJUSDR,Dow Jones U.S. Food & Drug Retailers Index,1619.8,1314.48,1697.13,23.227435944251713,39.54533201545516,游리,CERCA,250,2025-12-29 07:51:06
DJUSDS,Dow Jones U.S. Industrial Suppliers Index,919.19,683.22,994.97,34.537923362899214,44.77530142491777,游댮,FUERTE,250,2025-12-29 07:51:06
DJUSDT,Dow Jones U.S. Diversified REITs Index,55.73,45.49,60.0,22.510441855352813,52.81124497991969,游리,CERCA,250,2025-12-29 07:51:06
DJUSDV,Dow Jones U.S. Computer Services Index,304.58,231.08,312.52,31.80716634931624,46.81411269088999,游댮,FUERTE,250,2025-12-29 07:51:06
DJUSEC,Dow Jones U.S. Electrical Components & Equipment Index,1054.71,562.61,1122.04,87.46733972023249,51.491078484382165,游댮,FUERTE,250,2025-12-29 07:51:06
DJUSEE,Dow Jones U.S. Electronic & Electrical Equipment Index,1242.78,643.85,1306.8,93.0232196940281,51.62974683544303,游댮,FUERTE,250,2025-12-29 07:51:06
DJUSEH,Dow Jones U.S. Real Estate Holding & Development Index,68.56,50.8,69.58,34.96062992125986,17.632552404439025,游댮,FUERTE,183,2025-12-29 07:51:06
DJUSEN,Dow Jones U.S. Oil & Gas Index,746.74,623.85,792.27,19.698645507734227,60.00581170089112,游리,CERCA,249,2025-12-29 07:51:06
DJUSES,Dow Jones U.S. Real Estate Services Index,346.4,268.15,392.49,29.181428305053142,34.35950952256718,游댮,FUERTE,250,2025-12-29 07:51:06
DJUSEU,Dow Jones U.S. Electricity Index,423.72,340.99,471.47,24.26170855450307,47.56847400782558,游리,CERCA,250,2025-12-29 07:51:06
DJUSFA,Dow Jones U.S. Financial Administration Index,491.98,457.18,683.09,7.611881534625314,36.21162280701753,游릭,OPORTUNIDAD,250,2025-12-29 07:51:06
DJUSFB,Dow Jones U.S. Food & Beverage Index,693.72,668.77,770.54,3.7307295482751988,53.19420783645657,游릭,OPORTUNIDAD,250,2025-12-29 07:51:06
DJUSFC,Dow Jones U.S. Fixed Line Telecommunications Index,147.03,127.84,175.95,15.01095118898623,53.9384846211553,游리,CERCA,250,2025-12-29 07:51:06
DJUSFD,Dow Jones U.S. Food Retailers & Wholesalers Index,1178.82,1099.62,1346.72,7.202488132263878,46.32439889633424,游릭,OPORTUNIDAD,250,2025-12-29 07:51:06
DJUSFE,Dow Jones U.S. Industrial Machinery Index,1331.99,969.18,1350.05,37.43473864504014,42.59300678446279,游댮,FUERTE,249,2025-12-29 07:51:06
DJUSFH,Dow Jones U.S. Furnishings Index,491.1,319.67,509.31,53.62717802734069,50.62508055161745,游댮,FUERTE,249,2025-12-29 07:51:06
DJUSFI,Dow Jones U.S. Financial Services Index,2559.5,1907.9,2570.2,34.15273337177,20.30360531309293,游댮,FUERTE,250,2025-12-29 07:51:06
DJUSFO,Dow Jones U.S. Food Producers Index,357.23,352.44,428.42,1.3590965838156908,51.627088830255,游릭,OPORTUNIDAD,249,2025-12-29 07:51:06
DJUSFP,Dow Jones U.S. Food Products Index,498.45,491.28,625.15,1.4594528578407457,49.67935014963658,游릭,OPORTUNIDAD,249,2025-12-29 07:51:06
DJUSFT,Dow Jones U.S. Footwear Index,1352.2,1186.7,1942.6,13.946237465239738,55.120732722731034,游리,CERCA,250,2025-12-29 07:51:06
DJUSGF,Dow Jones U.S. Financial Services Index,2868.9,2138.5,2880.9,34.15478138882395,20.33802816901388,游댮,FUERTE,250,2025-12-29 07:51:06
DJUSGI,Dow Jones U.S. General Industrials Index,705.87,613.23,783.86,15.106893009148278,31.707818930041228,游리,CERCA,250,2025-12-29 07:51:06
DJUSGT,Dow Jones U.S. General Retailers Index,3444.6,2720.3,3649.5,26.62573980810939,44.40894568690094,游댮,FUERTE,250,2025-12-29 07:51:06
DJUSGU,Dow Jones U.S. Gas Distribution Index,379.85,313.15,397.36,21.29969663100752,45.205992509363334,游리,CERCA,250,2025-12-29 07:51:06
DJUSHB,Dow Jones U.S. Home Construction Index,2394.26,1872.38,2900.07,27.872547239342442,66.14771489190892,游댮,FUERTE,250,2025-12-29 07:51:06
DJUSHC,Dow Jones U.S. Health Care Index,1659.22,1344.15,1687.44,23.440092251608817,32.31698442730308,游리,CERCA,250,2025-12-29 07:51:06
DJUSHD,Dow Jones U.S. Durable Household Products Index,127.05,94.51,179.28,34.43021902444185,44.22604422604425,游댮,FUERTE,249,2025-12-29 07:51:06
DJUSHG,Dow Jones U.S. Household Goods & Home Construction Index,981.32,960.97,1158.74,2.1176519558362927,38.64296081277211,游릭,OPORTUNIDAD,250,2025-12-29 07:51:06
DJUSHI,Dow Jones U.S. Home Improvement Retailers Index,793.45,705.04,940.02,12.539714058776818,48.5683874401277,游리,CERCA,250,2025-12-29 07:51:06
DJUSHL,Dow Jones U.S. Hotel & Lodging REITs Index,98.12,65.02,99.61,50.907413103660424,27.365079365079396,游댮,FUERTE,250,2025-12-29 07:51:06
DJUSHN,Dow Jones U.S. Nondurable Household Products Index,1113.79,1069.63,1420.24,4.128530426409118,31.29718004338396,游릭,OPORTUNIDAD,250,2025-12-29 07:51:06
DJUSHP,Dow Jones U.S. Health Care Providers Index,2596.1,2106.6,3374.9,23.236494825785627,39.85507246376817,游리,CERCA,250,2025-12-29 07:51:06
DJUSHR,Dow Jones U.S. Commercial Vehicles & Trucks Index,6378.4,3916.0,6645.0,62.88049029622063,50.04675081813933,游댮,FUERTE,250,2025-12-29 07:51:06
DJUSHV,Dow Jones U.S. Heavy Construction Index,2196.65,1138.85,2402.18,92.88317162049438,58.47813478714765,游댮,FUERTE,250,2025-12-29 07:51:06
DJUSIB,Dow Jones U.S. Insurance Brokers Index,707.5,658.66,891.38,7.415054808247053,24.54074422986342,游릭,OPORTUNIDAD,250,2025-12-29 07:51:06
DJUSID,Dow Jones U.S. Diversified Industrials Index,933.42,767.22,1017.95,21.662626104637514,41.61813316543368,游리,CERCA,250,2025-12-29 07:51:06
DJUSIG,Dow Jones U.S. Industrial Goods & Services Index,1520.84,1094.74,1528.19,38.92248387745034,38.7740783263172,游댮,FUERTE,250,2025-12-29 07:51:06
DJUSIL,Dow Jones U.S. Life Insurance Index,1313.37,1077.94,1349.12,21.840733250459195,26.510422800612574,游리,CERCA,250,2025-12-29 07:51:06
DJUSIM,Dow Jones U.S. Industrial Metals & Mining Index,627.95,350.58,631.09,79.11746249072968,15.378088874748101,游댮,FUERTE,250,2025-12-29 07:51:06
DJUSIO,Dow Jones U.S. Industrial & Office REITs Index,109.86,79.12,112.78,38.85237613751263,41.738197424892704,游댮,FUERTE,250,2025-12-29 07:51:06
DJUSIP,Dow Jones U.S. Property & Casualty Insurance Index,2005.11,1755.13,2065.57,14.24281962019906,21.624916194307332,游리,CERCA,250,2025-12-29 07:51:06
DJUSIQ,Dow Jones U.S. Industrial Engineering Index,4964.4,3318.0,5103.0,49.62025316455695,45.89961117002477,游댮,FUERTE,250,2025-12-29 07:51:06
DJUSIR,Dow Jones U.S. Insurance Index,1355.34,1239.53,1458.0,9.343057449194449,19.5296009649213,游릭,OPORTUNIDAD,250,2025-12-29 07:51:06
DJUSIS,Dow Jones U.S. Support Services Index,795.84,748.64,949.87,6.304765975635826,43.32548095798969,游릭,OPORTUNIDAD,249,2025-12-29 07:51:06
DJUSIT,Dow Jones U.S. Industrial Transportation Index,1602.8,1243.5,1668.3,28.89425010052272,35.75367647058832,游댮,FUERTE,249,2025-12-29 07:51:06
DJUSIU,Dow Jones U.S. Reinsurance Index,552.75,467.58,573.95,18.21506480174516,8.036421219318996,游리,CERCA,250,2025-12-29 07:51:06
DJUSIV,Dow Jones U.S. Business Support Services Index,1139.17,1061.45,1395.19,7.3220594469829035,32.984383044448194,游릭,OPORTUNIDAD,250,2025-12-29 07:51:06
DJUSIX,Dow Jones U.S. Nonlife Insurance Index,1336.26,1215.03,1458.15,9.97753141897731,23.217517191458484,游릭,OPORTUNIDAD,249,2025-12-29 07:51:06
DJUSLE,Dow Jones U.S. Leisure Goods Index,1013.07,724.03,1249.95,39.92099774871208,76.78160919540227,游댮,FUERTE,250,2025-12-29 07:51:06
DJUSLG,Dow Jones U.S. Hotels Index,4749.0,3245.4,4761.0,46.33019042336846,19.402985074626827,游댮,FUERTE,250,2025-12-29 07:51:06
DJUSMC,Dow Jones U.S. Health Care Equipment & Services Index,2325.4,2083.0,2541.8,11.637061929908791,39.84593837535008,游리,CERCA,250,2025-12-29 07:51:06
DJUSME,Dow Jones U.S. Media Index,837.18,662.35,903.98,26.395410281573174,15.755855216465491,游댮,FUERTE,250,2025-12-29 07:51:06
DJUSMF,Dow Jones U.S. Mortgage Finance Index,13.42,9.98,13.76,34.4689378757515,31.506849315068436,游댮,FUERTE,250,2025-12-29 07:51:06
DJUSMG,Dow Jones U.S. Mining Index,236.95,84.25,238.17,181.24629080118692,14.264296423216962,游댮,FUERTE,250,2025-12-29 07:51:06
DJUSMR,Dow Jones U.S. Mortgage REITs Index,32.15,24.64,32.68,30.478896103896098,39.26380368098156,游댮,FUERTE,250,2025-12-29 07:51:06
DJUSMS,Dow Jones U.S. Medical Supplies Index,1872.89,1493.05,1967.6,25.440541174106706,41.08454737890671,游댮,FUERTE,249,2025-12-29 07:51:06
DJUSMT,Dow Jones U.S. Marine Transportation Index,364.0,261.01,402.11,39.45825830427954,56.54064904650385,游댮,FUERTE,250,2025-12-29 07:51:06
DJUSMU,Dow Jones U.S. Multiutilities Index,281.72,249.55,299.75,12.891204167501508,51.028806584362094,游리,CERCA,249,2025-12-29 07:51:06
DJUSNF,Dow Jones U.S. Nonferrous Metals Index,709.51,372.55,719.21,90.44691987652664,9.393641924035364,游댮,FUERTE,250,2025-12-29 07:51:06
DJUSNG,Dow Jones U.S. Personal & Household Goods Index,980.85,909.61,1081.16,7.8319279691296275,34.38753471150872,游릭,OPORTUNIDAD,250,2025-12-29 07:51:06
DJUSNS,Dow Jones U.S. Internet Index,7118.3,3842.4,7284.5,85.25661045180097,50.80799083852907,游댮,FUERTE,250,2025-12-29 07:51:06
DJUSOG,Dow Jones U.S. Oil & Gas Producers,842.47,707.01,896.57,19.159559270731677,55.65387560622818,游리,CERCA,250,2025-12-29 07:51:06
DJUSOI,Dow Jones U.S. Oil Equipment & Services Index,274.57,198.86,293.05,38.07201045961982,57.94895808944042,游댮,FUERTE,250,2025-12-29 07:51:06
DJUSOL,Dow Jones U.S. Integrated Oil & Gas Index,759.35,645.42,801.92,17.652071519320764,42.525829852714864,游리,CERCA,250,2025-12-29 07:51:06
DJUSOS,Dow Jones U.S. Exploration & Production Index,996.32,821.29,1097.99,21.311595173446662,69.7493927365365,游리,CERCA,250,2025-12-29 07:51:06
DJUSPB,Dow Jones U.S. Publishing Index,848.84,663.16,874.35,27.999276192774005,24.957794034890185,游댮,FUERTE,250,2025-12-29 07:51:06
DJUSPC,Dow Jones U.S. Waste & Disposal Services Index,647.66,589.23,708.03,9.916331483461457,29.074511488082322,游릭,OPORTUNIDAD,250,2025-12-29 07:51:06
DJUSPG,Sector PG,518.11,426.49,649.12,21.482332528312504,49.75869951739904,游리,CERCA,249,2025-12-29 07:51:06
DJUSPL,Dow Jones U.S. Pipelines Index,1016.97,925.07,1229.95,9.934383343963155,60.41795256150242,游릭,OPORTUNIDAD,250,2025-12-29 07:51:06
DJUSPM,Dow Jones U.S. Gold Mining Index,275.03,94.85,276.46,189.96309963099628,13.09084519416632,游댮,FUERTE,250,2025-12-29 07:51:06
DJUSPN,Dow Jones U.S. Pharmaceuticals & Biotechnology Index,1345.62,960.01,1360.66,40.16728992406328,29.820110701106998,游댮,FUERTE,250,2025-12-29 07:51:06
DJUSPR,Dow Jones U.S. Pharmaceuticals Index,1082.56,765.56,1089.83,41.40759705313757,33.41456810181424,游댮,FUERTE,249,2025-12-29 07:51:06
DJUSRA,Dow Jones U.S. Apparel Retailers Index,2094.34,1490.78,2102.53,40.48618843826723,29.756134504695467,游댮,FUERTE,250,2025-12-29 07:51:06
DJUSRB,Dow Jones U.S. Broadline Retailers Index,4871.5,3641.4,5185.7,33.78096336573845,48.75954198473287,游댮,FUERTE,249,2025-12-29 07:51:06
DJUSRD,Dow Jones U.S. Drug Retailers Index,1429.29,880.17,1533.48,62.38794778281469,33.28296184359665,游댮,FUERTE,250,2025-12-29 07:51:06
DJUSRE,Dow Jones U.S. Real Estate Index,359.35,311.91,382.25,15.209515565387449,48.47020933977442,游리,CERCA,250,2025-12-29 07:51:06
DJUSRH,Dow Jones U.S. Real Estate Investment & Services,726.46,563.1,822.79,29.010832889362458,34.36567164179105,游댮,FUERTE,250,2025-12-29 07:51:06
DJUSRI,Dow Jones U.S. Real Estate Investment Trusts Index,144.82,126.8,155.77,14.211356466876968,55.885471898197274,游리,CERCA,249,2025-12-29 07:51:06
DJUSRL,Dow Jones U.S. Retail REITs Index,100.14,83.32,103.81,20.1872299567931,35.17730496453889,游리,CERCA,250,2025-12-29 07:51:06
DJUSRN,Dow Jones U.S. Residential REITs Index,218.03,206.56,263.03,5.552865995352439,39.664570230607964,游릭,OPORTUNIDAD,249,2025-12-29 07:51:06
DJUSRP,Dow Jones U.S. Recreational Products Index,282.63,277.79,429.99,1.7423233377731286,63.402385436283836,游릭,OPORTUNIDAD,249,2025-12-29 07:51:06
DJUSRQ,Dow Jones U.S. Recreational Services Index,186.98,110.98,215.97,68.48080735267614,28.460570469798682,游댮,FUERTE,250,2025-12-29 07:51:06
DJUSRR,Dow Jones U.S. Railroads Index,3513.0,2788.9,3616.1,25.96364157911721,52.771000348553535,游댮,FUERTE,249,2025-12-29 07:51:06
DJUSRS,Dow Jones U.S. Specialty Retailers Index,4029.3,3427.2,4908.8,17.568277310924383,71.33262636974189,游리,CERCA,250,2025-12-29 07:51:06
DJUSRT,Dow Jones U.S. Retail Index,3098.0,2453.4,3267.5,26.27374256134344,53.36134453781518,游댮,FUERTE,249,2025-12-29 07:51:06
DJUSRU,Dow Jones U.S. Restaurants & Bars Index,2941.8,2686.2,3265.8,9.515300424391347,34.35008665511258,游릭,OPORTUNIDAD,250,2025-12-29 07:51:06
DJUSSB,Dow Jones U.S. Investment Services Index,3150.2,2060.8,3157.6,52.86296583850929,30.280830280830344,游댮,FUERTE,249,2025-12-29 07:51:06
DJUSSC,Dow Jones U.S. Semiconductors Index,28889.8,12938.1,31044.1,123.29244634065279,48.88736263736264,游댮,FUERTE,249,2025-12-29 07:51:06
DJUSSD,Dow Jones U.S. Soft Drinks Index,928.78,835.84,972.52,11.11935298621745,52.76956171013714,游리,CERCA,250,2025-12-29 07:51:06
DJUSSF,Dow Jones U.S. Consumer Finance Index,829.06,619.26,832.42,33.87914607757646,23.192668853942834,游댮,FUERTE,249,2025-12-29 07:51:06
DJUSSP,Dow Jones U.S. Specialty Finance Index,748.57,671.1,803.35,11.543734167784239,52.32938806346004,游리,CERCA,249,2025-12-29 07:51:06
DJUSSR,Dow Jones U.S. Specialty REITs Index,250.16,229.18,273.52,9.154376472641587,68.1730148482892,游릭,OPORTUNIDAD,250,2025-12-29 07:51:06
DJUSST,Dow Jones U.S. Iron & Steel Index,696.82,416.26,697.28,67.40018257819634,26.623457559516297,游댮,FUERTE,250,2025-12-29 07:51:06
DJUSSV,Dow Jones U.S. Software & Computer Services Index,8589.0,5509.7,8975.6,55.888705374158306,55.07559395248385,游댮,FUERTE,249,2025-12-29 07:51:06
DJUSSW,Dow Jones U.S. Software Index,8069.8,5758.2,9040.0,40.14448959744365,55.58346941339025,游댮,FUERTE,250,2025-12-29 07:51:06
DJUSTB,Dow Jones U.S. Tobacco Index,1076.73,824.94,1210.02,30.52221979780347,24.7797716150082,游댮,FUERTE,249,2025-12-29 07:51:06
DJUSTC,Dow Jones U.S. Technology Index,8921.0,5115.5,9259.3,74.39155507770502,53.932689603449866,游댮,FUERTE,250,2025-12-29 07:51:06
DJUSTK,Dow Jones U.S. Trucking Index,1603.14,1244.48,1858.35,28.820069426587818,38.11552561181023,游댮,FUERTE,250,2025-12-29 07:51:06
DJUSTL,Dow Jones U.S. Telecommunications Index,167.25,155.76,199.75,7.376733436055476,64.32616081540203,游릭,OPORTUNIDAD,249,2025-12-29 07:51:06
DJUSTQ,Dow Jones U.S. Technology Hardware & Equipment Index,10353.0,5326.7,10826.1,94.36048585428128,50.49935377746446,游댮,FUERTE,249,2025-12-29 07:51:06
DJUSTR,Dow Jones U.S. Tires Index,10353.0,5326.7,10826.1,94.36048585428128,50.49935377746446,游댮,FUERTE,249,2025-12-29 07:51:06
DJUSTT,Dow Jones U.S. Travel & Tourism Index,1334.24,957.74,1432.9,39.311295341115546,57.0124246987953,游댮,FUERTE,249,2025-12-29 07:51:06
DJUSTY,Dow Jones U.S. Toys Index,1679.73,1149.53,2066.13,46.12319817664611,76.21560497549955,游댮,FUERTE,250,2025-12-29 07:51:06
DJUSUT,Dow Jones U.S. Utilities Index,425.07,353.79,466.02,20.14754515390485,45.7716354063837,游리,CERCA,250,2025-12-29 07:51:06
DJUSVE,Dow Jones U.S. Conventional Electricity Index,424.8,341.92,472.89,24.239588207767895,47.579298831385614,游리,CERCA,250,2025-12-29 07:51:06
DJUSVN,Dow Jones U.S. Distillers & Vintners Index,279.45,260.67,444.55,7.2045114512602035,60.85526315789475,游릭,OPORTUNIDAD,250,2025-12-29 07:51:06
DJUSWC,Dow Jones U.S. Mobile Telecommunications Index,371.22,360.57,458.56,2.9536567102088456,59.543010752688105,游릭,OPORTUNIDAD,250,2025-12-29 07:51:06
DJUSWU,Dow Jones U.S. Water Index,2718.9,2432.7,3135.8,11.764705882352953,46.13866967305521,游리,CERCA,249,2025-12-29 07:51:06
