Ticker,Sector,CurrentPrice,Min52w,Max52w,DistanceFromMin,RSI,Estado,Classification,DataPoints,AnalysisDate
DJUSFR,Dow Jones U.S. Forestry & Paper Index,844.53,703.58,886.08,20.03325847806929,24.867483092670454,游리,CERCA,252,2026-01-22 07:53:53
DJUSAE,Dow Jones U.S. Aerospace & Defense Index,3243.2,1861.2,3291.4,74.25316999785083,25.99176954732512,游댮,FUERTE,252,2026-01-22 07:53:53
DJUSAF,Dow Jones U.S. Delivery Services Index,1322.2,916.9,1333.2,44.203293707056396,26.689520078354548,游댮,FUERTE,251,2026-01-22 07:53:53
DJUSAG,Dow Jones U.S. Asset Managers Index,405.04,273.77,426.58,47.94900829163168,44.99456587368674,游댮,FUERTE,252,2026-01-22 07:53:53
DJUSAI,Dow Jones U.S. Electronic Equipment Index,2048.74,913.78,2062.56,124.20495086344631,30.113850403917795,游댮,FUERTE,252,2026-01-22 07:53:53
DJUSAL,Dow Jones U.S. Aluminum Index,218.19,73.62,228.71,196.3732681336593,33.12161599333612,游댮,FUERTE,252,2026-01-22 07:53:53
DJUSAM,Dow Jones U.S. Medical Equipment Index,2965.3,2589.3,3151.1,14.521299192832037,55.826240093924255,游리,CERCA,252,2026-01-22 07:53:53
DJUSAP,Dow Jones U.S. Automobiles & Parts Index,1634.39,845.49,1853.16,93.3068398206957,59.181490948927944,游댮,FUERTE,252,2026-01-22 07:53:53
DJUSAR,Dow Jones U.S. Airlines Index,258.54,137.83,274.21,87.578901545382,48.27096162955946,游댮,FUERTE,252,2026-01-22 07:53:53
DJUSAS,Dow Jones U.S. Aerospace Index,3516.6,1883.9,3572.2,86.6659589150167,29.5425667090216,游댮,FUERTE,252,2026-01-22 07:53:53
DJUSAT,Dow Jones U.S. Auto Parts Index,433.91,288.25,447.84,50.53252385082395,37.36138459944034,游댮,FUERTE,251,2026-01-22 07:53:53
DJUSAU,Dow Jones U.S. Automobiles Index,1490.98,758.25,1704.26,96.63435542367293,59.96996078213224,游댮,FUERTE,252,2026-01-22 07:53:53
DJUSAV,Dow Jones U.S. Media Agencies Index,353.77,346.44,656.63,2.115806488858095,65.6887507285798,游릭,OPORTUNIDAD,252,2026-01-22 07:53:53
DJUSBC,Dow Jones U.S. Broadcasting & Entertainment Index,1215.2,962.0,1294.9,26.320166320166326,62.029569892473106,游댮,FUERTE,252,2026-01-22 07:53:53
DJUSBD,Dow Jones U.S. Building Materials & Fixtures Index,2434.6,1876.9,2514.3,29.713889924876113,41.90603429080384,游댮,FUERTE,252,2026-01-22 07:53:53
DJUSBE,Dow Jones U.S. Business Training & Employment Agencies Index,94.92,93.84,143.02,1.1508951406649597,69.23076923076916,游릭,OPORTUNIDAD,252,2026-01-22 07:53:53
DJUSBK,Dow Jones U.S. Banks Index,808.33,521.55,869.8,54.98609912760044,59.564780716437866,游댮,FUERTE,252,2026-01-22 07:53:53
DJUSBS,Dow Jones U.S. Basic Resources Index,612.21,274.91,622.8,122.69470008366375,17.819086878743036,游댮,FUERTE,251,2026-01-22 07:53:53
DJUSBT,Dow Jones U.S. Biotechnology Index,3230.8,2297.4,3319.4,40.628536606598765,43.955349620893,游댮,FUERTE,252,2026-01-22 07:53:53
DJUSBV,Dow Jones U.S. Beverages Index,982.82,884.01,1013.26,11.177475367925709,35.952813067150586,游리,CERCA,252,2026-01-22 07:53:53
DJUSCA,Dow Jones U.S. Gambling Index,591.83,513.6,786.57,15.231697819314643,73.69175138159238,游리,CERCA,252,2026-01-22 07:53:53
DJUSCC,Dow Jones U.S. Commodity Chemicals Index,696.41,608.9,794.88,14.371818032517652,30.18642447418739,游리,CERCA,251,2026-01-22 07:53:53
DJUSCH,Dow Jones U.S. Chemicals Index,1927.65,1497.87,2050.51,28.692743696048407,52.13457604000907,游댮,FUERTE,252,2026-01-22 07:53:53
DJUSCM,Dow Jones U.S. Personal Products Index,412.07,341.42,452.45,20.692988108488073,25.57330057330057,游리,CERCA,252,2026-01-22 07:53:53
DJUSCN,Dow Jones U.S. Construction & Materials Index,2136.21,1484.39,2145.98,43.91164047184365,35.95000664805215,游댮,FUERTE,252,2026-01-22 07:53:53
DJUSCP,Dow Jones U.S. Containers & Packaging Index,440.85,388.62,514.38,13.439864134630234,38.860759493670884,游리,CERCA,252,2026-01-22 07:53:53
DJUSCR,Dow Jones U.S. Computer Hardware Index,12738.5,8364.8,14401.2,52.286964422341256,81.27221940071102,游댮,FUERTE,252,2026-01-22 07:53:53
DJUSCS,Dow Jones U.S. Specialized Consumer Services Index,2402.4,2307.7,3402.3,4.103652987823386,45.420624151967424,游릭,OPORTUNIDAD,252,2026-01-22 07:53:53
DJUSCT,Dow Jones U.S. Telecommunications Equipment Index,2678.91,1708.47,2800.11,56.801699766457695,56.766416880299744,游댮,FUERTE,251,2026-01-22 07:53:53
DJUSCX,Dow Jones U.S. Specialty Chemicals Index,1172.78,863.05,1176.14,35.8878396384914,21.731611713165805,游댮,FUERTE,252,2026-01-22 07:53:53
DJUSDB,Dow Jones U.S. Brewers Index,514.82,438.36,659.78,17.442284880007307,32.151801194374855,游리,CERCA,252,2026-01-22 07:53:53
DJUSDN,Dow Jones U.S. Defense Index,899.49,598.11,912.38,50.388724482118675,24.076607387140896,游댮,FUERTE,252,2026-01-22 07:53:53
DJUSDR,Dow Jones U.S. Food & Drug Retailers Index,1656.44,1341.74,1697.13,23.45461862954075,36.793258554916555,游리,CERCA,252,2026-01-22 07:53:53
DJUSDS,Dow Jones U.S. Industrial Suppliers Index,1031.36,683.22,1037.79,50.95576827376246,23.566878980891744,游댮,FUERTE,252,2026-01-22 07:53:53
DJUSDT,Dow Jones U.S. Diversified REITs Index,59.83,46.37,60.41,29.02738839767091,30.28692879914982,游댮,FUERTE,252,2026-01-22 07:53:53
DJUSDV,Dow Jones U.S. Computer Services Index,297.04,231.08,312.52,28.54422710749524,52.50847457627119,游댮,FUERTE,252,2026-01-22 07:53:53
DJUSEC,Dow Jones U.S. Electrical Components & Equipment Index,1102.3,562.61,1122.04,95.92613000124419,36.97560545237993,游댮,FUERTE,252,2026-01-22 07:53:53
DJUSEE,Dow Jones U.S. Electronic & Electrical Equipment Index,1317.98,643.85,1328.06,104.70295876368718,34.51333686627805,游댮,FUERTE,252,2026-01-22 07:53:53
DJUSEH,Dow Jones U.S. Real Estate Holding & Development Index,68.56,50.8,69.58,34.96062992125986,17.632552404439025,游댮,FUERTE,169,2026-01-22 07:53:53
DJUSEN,Dow Jones U.S. Oil & Gas Index,821.52,623.85,825.41,31.685501322433268,30.208465742976955,游댮,FUERTE,251,2026-01-22 07:53:53
DJUSES,Dow Jones U.S. Real Estate Services Index,346.21,268.15,392.49,29.110572440798066,48.90243902439025,游댮,FUERTE,252,2026-01-22 07:53:53
DJUSEU,Dow Jones U.S. Electricity Index,424.5,340.99,471.47,24.49045426552098,50.098196750580264,游리,CERCA,252,2026-01-22 07:53:53
DJUSFA,Dow Jones U.S. Financial Administration Index,471.43,457.18,683.09,3.116934249092261,61.278339951325734,游릭,OPORTUNIDAD,252,2026-01-22 07:53:53
DJUSFB,Dow Jones U.S. Food & Beverage Index,719.11,667.95,770.54,7.659255932330258,36.07007901064921,游릭,OPORTUNIDAD,252,2026-01-22 07:53:53
DJUSFC,Dow Jones U.S. Fixed Line Telecommunications Index,140.6,131.54,175.95,6.887638741067358,71.3785046728971,游릭,OPORTUNIDAD,252,2026-01-22 07:53:53
DJUSFD,Dow Jones U.S. Food Retailers & Wholesalers Index,1209.4,1099.62,1346.72,9.983448827776888,37.24795464794171,游릭,OPORTUNIDAD,252,2026-01-22 07:53:53
DJUSFE,Dow Jones U.S. Industrial Machinery Index,1407.52,969.18,1417.17,45.227924637322275,33.148526407936984,游댮,FUERTE,251,2026-01-22 07:53:53
DJUSFH,Dow Jones U.S. Furnishings Index,518.18,319.67,522.99,62.09841398942657,35.763947770052596,游댮,FUERTE,251,2026-01-22 07:53:53
DJUSFI,Dow Jones U.S. Financial Services Index,2491.2,1907.9,2608.7,30.572881178258804,58.38815789473687,游댮,FUERTE,252,2026-01-22 07:53:53
DJUSFO,Dow Jones U.S. Food Producers Index,371.73,341.8,428.42,8.756582796957286,37.913188647746225,游릭,OPORTUNIDAD,251,2026-01-22 07:53:53
DJUSFP,Dow Jones U.S. Food Products Index,503.53,470.3,625.15,7.065702742930036,46.74038240036861,游릭,OPORTUNIDAD,251,2026-01-22 07:53:53
DJUSFT,Dow Jones U.S. Footwear Index,1423.1,1186.7,1942.6,19.92078874188926,38.81913810654906,游리,CERCA,252,2026-01-22 07:53:53
DJUSGF,Dow Jones U.S. Financial Services Index,2792.3,2138.5,2924.0,30.572831423895263,58.3798062811858,游댮,FUERTE,252,2026-01-22 07:53:53
DJUSGI,Dow Jones U.S. General Industrials Index,739.41,613.23,783.86,20.57629274497333,36.66844065992554,游리,CERCA,252,2026-01-22 07:53:53
DJUSGT,Dow Jones U.S. General Retailers Index,3527.8,2720.3,3649.5,29.6842260044848,39.90374555346304,游댮,FUERTE,252,2026-01-22 07:53:53
DJUSGU,Dow Jones U.S. Gas Distribution Index,384.76,324.1,397.36,18.716445541499528,43.05598515310851,游리,CERCA,252,2026-01-22 07:53:53
DJUSHB,Dow Jones U.S. Home Construction Index,2611.28,1872.38,2900.07,39.463143165383094,33.54914089347078,游댮,FUERTE,252,2026-01-22 07:53:53
DJUSHC,Dow Jones U.S. Health Care Index,1677.75,1344.15,1708.01,24.818658631849118,43.139872315728354,游리,CERCA,252,2026-01-22 07:53:53
DJUSHD,Dow Jones U.S. Durable Household Products Index,143.15,94.51,179.28,51.46545339117553,26.331102705848053,游댮,FUERTE,251,2026-01-22 07:53:53
DJUSHG,Dow Jones U.S. Household Goods & Home Construction Index,1019.38,943.49,1158.74,8.043540472077074,31.815097540288377,游릭,OPORTUNIDAD,252,2026-01-22 07:53:53
DJUSHI,Dow Jones U.S. Home Improvement Retailers Index,881.69,705.04,940.02,25.05531601043914,20.979611533357485,游댮,FUERTE,252,2026-01-22 07:53:53
DJUSHL,Dow Jones U.S. Hotel & Lodging REITs Index,99.39,65.02,100.06,52.86065825899724,45.156761815629366,游댮,FUERTE,252,2026-01-22 07:53:53
DJUSHN,Dow Jones U.S. Nondurable Household Products Index,1137.11,1067.39,1420.24,6.531820609149401,40.69711372873182,游릭,OPORTUNIDAD,252,2026-01-22 07:53:53
DJUSHP,Dow Jones U.S. Health Care Providers Index,2663.9,2106.6,3374.9,26.45495110604767,42.198100407055634,游댮,FUERTE,252,2026-01-22 07:53:53
DJUSHR,Dow Jones U.S. Commercial Vehicles & Trucks Index,7090.0,3916.0,7104.4,81.05209397344228,25.710817200178894,游댮,FUERTE,252,2026-01-22 07:53:53
DJUSHV,Dow Jones U.S. Heavy Construction Index,2432.11,1138.85,2455.08,113.55841418975285,29.108114502010835,游댮,FUERTE,252,2026-01-22 07:53:53
DJUSIB,Dow Jones U.S. Insurance Brokers Index,673.85,658.66,891.38,2.306197431148097,67.25636568156253,游릭,OPORTUNIDAD,252,2026-01-22 07:53:53
DJUSID,Dow Jones U.S. Diversified Industrials Index,979.98,767.22,1019.39,27.731289590990848,36.33953660993586,游댮,FUERTE,252,2026-01-22 07:53:53
DJUSIG,Dow Jones U.S. Industrial Goods & Services Index,1613.36,1094.74,1623.74,47.37380565248369,30.47513134179546,游댮,FUERTE,252,2026-01-22 07:53:53
DJUSIL,Dow Jones U.S. Life Insurance Index,1276.78,1077.94,1349.12,18.446295712191766,58.66787860425186,游리,CERCA,252,2026-01-22 07:53:53
DJUSIM,Dow Jones U.S. Industrial Metals & Mining Index,696.57,350.58,702.19,98.69074105767588,22.52578009910269,游댮,FUERTE,252,2026-01-22 07:53:53
DJUSIO,Dow Jones U.S. Industrial & Office REITs Index,111.08,79.12,114.17,40.39433771486349,46.50205761316875,游댮,FUERTE,252,2026-01-22 07:53:53
DJUSIP,Dow Jones U.S. Property & Casualty Insurance Index,1873.63,1792.93,2065.57,4.501012309459937,76.82992465016142,游릭,OPORTUNIDAD,252,2026-01-22 07:53:53
DJUSIQ,Dow Jones U.S. Industrial Engineering Index,5390.3,3318.0,5412.9,62.456298975286316,28.63444392304085,游댮,FUERTE,252,2026-01-22 07:53:53
DJUSIR,Dow Jones U.S. Insurance Index,1281.78,1239.53,1458.0,3.408550014925012,72.52398046254338,游릭,OPORTUNIDAD,252,2026-01-22 07:53:53
DJUSIS,Dow Jones U.S. Support Services Index,813.59,748.64,949.87,8.675731994015822,41.648944871585115,游릭,OPORTUNIDAD,251,2026-01-22 07:53:53
DJUSIT,Dow Jones U.S. Industrial Transportation Index,1652.3,1243.5,1668.3,32.87494973864093,38.27915869980882,游댮,FUERTE,251,2026-01-22 07:53:53
DJUSIU,Dow Jones U.S. Reinsurance Index,529.98,467.58,573.95,13.34530989349417,65.89473684210526,游리,CERCA,252,2026-01-22 07:53:53
DJUSIV,Dow Jones U.S. Business Support Services Index,1174.29,1061.45,1395.19,10.630740967544389,40.70344564283668,游리,CERCA,252,2026-01-22 07:53:53
DJUSIX,Dow Jones U.S. Nonlife Insurance Index,1256.97,1215.03,1458.15,3.4517666230463493,74.64613562333435,游릭,OPORTUNIDAD,251,2026-01-22 07:53:53
DJUSLE,Dow Jones U.S. Leisure Goods Index,980.57,724.03,1249.95,35.432233470988784,58.881560403630424,游댮,FUERTE,252,2026-01-22 07:53:53
DJUSLG,Dow Jones U.S. Hotels Index,4817.3,3245.4,4965.9,48.434707586121895,44.329672719365014,游댮,FUERTE,252,2026-01-22 07:53:53
DJUSMC,Dow Jones U.S. Health Care Equipment & Services Index,2330.4,2083.0,2541.8,11.877100336053772,48.395620989052475,游리,CERCA,252,2026-01-22 07:53:53
DJUSME,Dow Jones U.S. Media Index,818.03,662.35,903.98,23.50418962784026,63.00096184674577,游리,CERCA,252,2026-01-22 07:53:53
DJUSMF,Dow Jones U.S. Mortgage Finance Index,13.6,9.98,14.77,36.27254509018035,50.0,游댮,FUERTE,252,2026-01-22 07:53:53
DJUSMG,Dow Jones U.S. Mining Index,268.34,94.18,275.78,184.92248885113608,18.729096989966564,游댮,FUERTE,252,2026-01-22 07:53:53
DJUSMR,Dow Jones U.S. Mortgage REITs Index,33.48,24.64,34.04,35.876623376623364,37.41258741258743,游댮,FUERTE,252,2026-01-22 07:53:53
DJUSMS,Dow Jones U.S. Medical Supplies Index,1875.58,1493.05,1967.6,25.620709286360132,47.03261552521852,游댮,FUERTE,251,2026-01-22 07:53:53
DJUSMT,Dow Jones U.S. Marine Transportation Index,425.15,261.01,429.52,62.88647944523198,13.37426267003734,游댮,FUERTE,252,2026-01-22 07:53:53
DJUSMU,Dow Jones U.S. Multiutilities Index,288.15,249.55,299.75,15.467842115808441,42.012214721954386,游리,CERCA,251,2026-01-22 07:53:53
DJUSNF,Dow Jones U.S. Nonferrous Metals Index,810.37,372.55,830.7,117.51979600053684,23.872204472843464,游댮,FUERTE,252,2026-01-22 07:53:53
DJUSNG,Dow Jones U.S. Personal & Household Goods Index,1012.52,909.61,1081.16,11.313639911610467,35.06693198263386,游리,CERCA,252,2026-01-22 07:53:53
DJUSNS,Dow Jones U.S. Internet Index,7143.6,3842.4,7426.7,85.91505309181761,48.65295288652951,游댮,FUERTE,252,2026-01-22 07:53:53
DJUSOG,Dow Jones U.S. Oil & Gas Producers,925.86,707.01,932.4,30.954300504943355,31.13812154696133,游댮,FUERTE,252,2026-01-22 07:53:53
DJUSOI,Dow Jones U.S. Oil Equipment & Services Index,336.8,198.86,337.64,69.36538268128331,18.808538444783252,游댮,FUERTE,252,2026-01-22 07:53:53
DJUSOL,Dow Jones U.S. Integrated Oil & Gas Index,848.26,645.42,851.15,31.427597533389118,29.254914738785686,游댮,FUERTE,252,2026-01-22 07:53:53
DJUSOS,Dow Jones U.S. Exploration & Production Index,1067.67,821.29,1095.2,29.999147682304685,37.76313905198334,游댮,FUERTE,252,2026-01-22 07:53:53
DJUSPB,Dow Jones U.S. Publishing Index,853.32,663.16,874.35,28.67482960371556,46.8910439247005,游댮,FUERTE,252,2026-01-22 07:53:53
DJUSPC,Dow Jones U.S. Waste & Disposal Services Index,662.65,589.23,708.03,12.460329582675687,41.31214761660692,游리,CERCA,252,2026-01-22 07:53:53
DJUSPG,Sector PG,534.91,426.49,649.12,25.421463574761415,38.276418392040945,游댮,FUERTE,251,2026-01-22 07:53:53
DJUSPL,Dow Jones U.S. Pipelines Index,1072.7,925.07,1229.73,15.958792307609151,37.30158730158731,游리,CERCA,252,2026-01-22 07:53:53
DJUSPM,Dow Jones U.S. Gold Mining Index,310.57,106.02,318.46,192.93529522731563,18.65771812080534,游댮,FUERTE,252,2026-01-22 07:53:53
DJUSPN,Dow Jones U.S. Pharmaceuticals & Biotechnology Index,1367.67,960.01,1386.88,42.46414099853128,42.62383152465884,游댮,FUERTE,252,2026-01-22 07:53:53
DJUSPR,Dow Jones U.S. Pharmaceuticals Index,1105.46,765.56,1117.37,44.39887141438948,42.05794851894967,游댮,FUERTE,251,2026-01-22 07:53:53
DJUSRA,Dow Jones U.S. Apparel Retailers Index,2124.6,1490.78,2154.58,42.51599833644132,39.206057824690355,游댮,FUERTE,252,2026-01-22 07:53:53
DJUSRB,Dow Jones U.S. Broadline Retailers Index,4982.2,3641.4,5208.1,36.821002910968296,42.70872449618225,游댮,FUERTE,251,2026-01-22 07:53:53
DJUSRD,Dow Jones U.S. Drug Retailers Index,1455.47,935.6,1533.48,55.565412569474134,41.7655901715826,游댮,FUERTE,252,2026-01-22 07:53:53
DJUSRE,Dow Jones U.S. Real Estate Index,367.16,311.91,382.25,17.713442980346894,40.99585062240658,游리,CERCA,252,2026-01-22 07:53:53
DJUSRH,Dow Jones U.S. Real Estate Investment & Services,726.07,563.1,822.79,28.941573432782814,48.90261627906973,游댮,FUERTE,252,2026-01-22 07:53:53
DJUSRI,Dow Jones U.S. Real Estate Investment Trusts Index,148.25,126.8,155.77,16.916403785488964,40.154711673698955,游리,CERCA,251,2026-01-22 07:53:53
DJUSRL,Dow Jones U.S. Retail REITs Index,103.17,83.32,103.81,23.823811809889595,30.779220779220694,游리,CERCA,252,2026-01-22 07:53:53
DJUSRN,Dow Jones U.S. Residential REITs Index,216.53,206.56,263.03,4.826684740511231,55.0481430536451,游릭,OPORTUNIDAD,251,2026-01-22 07:53:53
DJUSRP,Dow Jones U.S. Recreational Products Index,324.26,274.92,429.99,17.947039138658507,20.096551724137882,游리,CERCA,251,2026-01-22 07:53:53
DJUSRQ,Dow Jones U.S. Recreational Services Index,177.38,110.98,215.97,59.830600108127584,58.87265135699374,游댮,FUERTE,252,2026-01-22 07:53:53
DJUSRR,Dow Jones U.S. Railroads Index,3474.4,2788.9,3616.1,24.579583348273513,52.56688358640638,游리,CERCA,251,2026-01-22 07:53:53
DJUSRS,Dow Jones U.S. Specialty Retailers Index,3926.9,3427.2,4908.8,14.580415499533157,59.799157758341444,游리,CERCA,252,2026-01-22 07:53:53
DJUSRT,Dow Jones U.S. Retail Index,3172.5,2453.4,3267.5,29.310344827586203,39.52759701132802,游댮,FUERTE,251,2026-01-22 07:53:53
DJUSRU,Dow Jones U.S. Restaurants & Bars Index,2977.9,2686.2,3265.8,10.859206313751779,37.50879662209711,游리,CERCA,252,2026-01-22 07:53:53
DJUSSB,Dow Jones U.S. Investment Services Index,3186.3,2060.8,3276.0,54.614712732919244,41.551833792664794,游댮,FUERTE,251,2026-01-22 07:53:53
DJUSSC,Dow Jones U.S. Semiconductors Index,29464.5,12938.1,31044.1,127.73436594244905,42.36365243525147,游댮,FUERTE,251,2026-01-22 07:53:53
DJUSSD,Dow Jones U.S. Soft Drinks Index,955.79,848.43,972.52,12.653960845326075,38.065005211788154,游리,CERCA,252,2026-01-22 07:53:53
DJUSSF,Dow Jones U.S. Consumer Finance Index,763.03,619.26,837.68,23.216419597584213,74.16652980785025,游리,CERCA,251,2026-01-22 07:53:53
DJUSSP,Dow Jones U.S. Specialty Finance Index,725.11,682.16,803.35,6.29617685000587,77.810982443033,游릭,OPORTUNIDAD,251,2026-01-22 07:53:53
DJUSSR,Dow Jones U.S. Specialty REITs Index,257.86,229.18,273.52,12.514180993105859,38.31472812387468,游리,CERCA,252,2026-01-22 07:53:53
DJUSST,Dow Jones U.S. Iron & Steel Index,747.16,416.26,750.18,79.49358573968193,29.318226992645606,游댮,FUERTE,252,2026-01-22 07:53:53
DJUSSV,Dow Jones U.S. Software & Computer Services Index,8095.6,5509.7,8975.6,46.93358985062709,73.46506704304866,游댮,FUERTE,251,2026-01-22 07:53:53
DJUSSW,Dow Jones U.S. Software Index,7203.1,5758.2,9040.0,25.09291097912543,80.72650855598917,游댮,FUERTE,252,2026-01-22 07:53:53
DJUSTB,Dow Jones U.S. Tobacco Index,1132.28,854.25,1210.02,32.54667837284167,38.36047372316804,游댮,FUERTE,251,2026-01-22 07:53:53
DJUSTC,Dow Jones U.S. Technology Index,8622.5,5115.5,9259.3,68.55634835304467,64.52439166375595,游댮,FUERTE,252,2026-01-22 07:53:53
DJUSTK,Dow Jones U.S. Trucking Index,1742.15,1244.48,1858.35,39.99019670866547,32.27930267062314,游댮,FUERTE,252,2026-01-22 07:53:53
DJUSTL,Dow Jones U.S. Telecommunications Index,159.23,158.03,199.75,0.7593494906030429,75.67867036011086,游릭,OPORTUNIDAD,251,2026-01-22 07:53:53
DJUSTQ,Dow Jones U.S. Technology Hardware & Equipment Index,10223.7,5326.7,10826.1,91.93309178290501,51.670079344765774,游댮,FUERTE,251,2026-01-22 07:53:53
DJUSTR,Dow Jones U.S. Tires Index,10223.7,5326.7,10826.1,91.93309178290501,51.670079344765774,游댮,FUERTE,251,2026-01-22 07:53:53
DJUSTT,Dow Jones U.S. Travel & Tourism Index,1315.52,957.74,1432.9,37.356693883517444,55.65012079947285,游댮,FUERTE,251,2026-01-22 07:53:53
DJUSTY,Dow Jones U.S. Toys Index,1611.62,1149.53,2066.13,40.19816794690003,60.82087136660844,游댮,FUERTE,252,2026-01-22 07:53:53
DJUSUT,Dow Jones U.S. Utilities Index,428.27,353.79,466.02,21.052036518838847,48.00555665806708,游리,CERCA,252,2026-01-22 07:53:53
DJUSVE,Dow Jones U.S. Conventional Electricity Index,425.46,341.92,472.89,24.432615816565267,50.1964285714286,游리,CERCA,252,2026-01-22 07:53:53
DJUSVN,Dow Jones U.S. Distillers & Vintners Index,320.87,260.67,391.98,23.09433383204818,23.23517547398147,游리,CERCA,252,2026-01-22 07:53:53
DJUSWC,Dow Jones U.S. Mobile Telecommunications Index,352.34,349.48,458.56,0.8183587043607521,74.58723784024991,游릭,OPORTUNIDAD,252,2026-01-22 07:53:53
DJUSWU,Dow Jones U.S. Water Index,2739.3,2472.2,3135.8,10.804142059703922,48.060978871355985,游리,CERCA,251,2026-01-22 07:53:53
