ticker,company_name,fundamental_score,tier,quality,earnings_quality_score,growth_acceleration_score,relative_strength_score,financial_health_score,catalyst_timing_score,rs_line_score,rs_line_percentile,rs_line_at_new_high,rs_line_trend,eps_growth_yoy,eps_accelerating,eps_accel_quarters,rev_growth_yoy,rev_accelerating,rev_accel_quarters,earnings_details,growth_details,rs_details,health_details,catalyst_details,current_price,market_cap,sector,industry,short_percent_float,short_ratio,short_squeeze_potential,fifty_two_week_high,proximity_to_52w_high,trend_template_score,trend_template_pass,target_price_analyst,target_price_analyst_high,target_price_analyst_low,analyst_count,analyst_recommendation,analyst_upside_pct,target_price_dcf,target_price_dcf_upside_pct,target_price_pe,target_price_pe_upside_pct,fcf_yield_pct,fcf_per_share,dividend_yield_pct,payout_ratio_pct,dividend_rate,five_yr_avg_dividend_yield_pct,buyback_active,shares_change_pct,interest_coverage,analyst_revision_momentum,days_to_earnings,earnings_date,earnings_warning,earnings_catalyst,piotroski_score,piotroski_label,ebit_ev_yield,roic_greenblatt,peg_ratio,hv_30d,atm_iv,iv_ratio,iv_premium_pts,analyzed_at,market,value_score,fcf_bonus,dividend_bonus,buyback_bonus,revision_bonus,risk_reward_ratio,rr_bonus,eu_insider_bonus,market_regime,ai_verdict,ai_confidence,ai_reasoning,data_warning,entry_price,stop_loss,exit_price,risk_pct,reward_pct,entry_timing
G24.DE,Scout24 SE                    N,71.8,⭐⭐⭐ EXCELLENT,🟢 Excellent,95.0,60.0,50.0,75.0,70.0,,,,,37.0,False,0,14.0,False,0,"{'eps_growth_yoy': 37.0, 'positive_quarters': 4, 'earnings_accelerating': False, 'eps_accel_quarters': 0, 'profit_margin_pct': 37.4}","{'revenue_growth_yoy': 14.0, 'revenue_accelerating': False, 'rev_accel_quarters': 0}","{'rs_3m': -1.4, 'rs_6m': -18.8}","{'roe_pct': 17.7, 'debt_to_equity': 0.25, 'current_ratio': 0.22, 'operating_margin_pct': 55.2}","{'days_to_earnings': 'N/A', 'recommendation': 'strong_buy', 'analyst_upside_pct': 46.8}",72.725,5142782976,Communication Services,Internet Content & Information,,,False,122.8,-40.8,0,False,106.76,140.0,86.0,17,strong_buy,46.8,,,108.3,48.9,,,2.07,36.6,1.5,1.51,,,44.1,40.6,17.0,2026-08-06,False,True,6,NEUTRAL,5.22,635.9,0.37,27.3,,,,2026-07-20T07:18:17.222442,DAX40,61.7,0.0,5.0,0.0,5.0,5.85,3.0,8.0,CONFIRMED_UPTREND,BUY,85,"Strong fundamentals with ROE of 17.7%, margin of 37.4%, and debt/equity of 0.25, combined with a significant upside of 46.8% and validation from 17 analysts",,71.54,67.67,108.47,5.41,51.62,BUY ON PULLBACK - Wait for 2-5% dip
SAP.DE,SAP SE                        I,65.2,⭐⭐ GOOD,🟡 Good,90.0,50.0,30.0,85.0,70.0,,,,,13.8,True,1,5.8,False,0,"{'eps_growth_yoy': 13.8, 'positive_quarters': 4, 'earnings_accelerating': True, 'eps_accel_quarters': 1, 'profit_margin_pct': 19.6}","{'revenue_growth_yoy': 5.8, 'revenue_accelerating': False, 'rev_accel_quarters': 0}","{'rs_3m': -10.1, 'rs_6m': -33.6}","{'roe_pct': 16.4, 'debt_to_equity': 0.17, 'current_ratio': 1.07, 'operating_margin_pct': 30.0}","{'days_to_earnings': 'N/A', 'recommendation': 'strong_buy', 'analyst_upside_pct': 47.5}",139.72,163131342848,Technology,Software - Application,,,False,265.4,-47.4,0,False,206.04,290.0,154.99,25,strong_buy,47.5,133.62,-4.4,62.3,-55.4,4.99,6.98,1.81,37.7,2.5,1.45,True,-2.51,21.9,9.3,3.0,2026-07-23,True,False,8,STRONG,6.78,146.7,1.78,33.0,,,,2026-07-20T07:18:21.170753,DAX40,50.1,3.0,5.0,3.0,3.0,5.94,3.0,0.0,CONFIRMED_UPTREND,BUY,85,"Strong fundamentals with ROE > 10%, margin > 10%, and debt < 2x, combined with analyst validation and a realistic upside of 47.5%","El dato más sospechoso es la distancia al máximo de 52 semanas de -47.4%: SAP cotiza cerca de máximos históricos en 2024-2025 (en torno a 200-230 EUR), por lo que una caída del 47% desde el máximo implicaría un precio de ~110-120 EUR, incompatible con el precio indicado de 139.72 USD. Además, el precio en USD (~139) no cuadra bien con el precio real en EUR (~200+), lo que sugiere que yfinance puede estar devolviendo un precio desactualizado o de una clase de acción incorrecta.",136.75,128.24,220.88,6.22,61.52,BUY NOW - At target entry price
DB1.DE,DEUTSCHE BOERSE AG            N,71.8,⭐⭐⭐ EXCELLENT,🟢 Excellent,95.0,50.0,64.0,80.0,60.0,,,,,11.4,True,1,8.5,False,0,"{'eps_growth_yoy': 11.4, 'positive_quarters': 4, 'earnings_accelerating': True, 'eps_accel_quarters': 1, 'profit_margin_pct': 27.3}","{'revenue_growth_yoy': 8.5, 'revenue_accelerating': False, 'rev_accel_quarters': 0}","{'rs_3m': -6.4, 'rs_6m': 16.9}","{'roe_pct': 19.2, 'debt_to_equity': 0.65, 'current_ratio': 1.01, 'operating_margin_pct': 43.6}","{'days_to_earnings': 'N/A', 'recommendation': 'buy', 'analyst_upside_pct': 11.7}",256.9,46783012864,Financial Services,Financial Data & Stock Exchanges,,,False,269.6,-4.7,6,False,286.83,310.0,240.0,12,buy,11.7,,,137.01,-46.7,,,1.63,35.7,4.2,1.87,,,,12.2,2.0,2026-07-22,True,False,5,NEUTRAL,5.93,66.8,1.58,24.8,,,,2026-07-20T07:17:02.000764,DAX40,58.7,0.0,5.0,0.0,3.0,1.46,0.0,15.0,CONFIRMED_UPTREND,BUY,85,"Strong fundamentals with ROE > 10%, Margin > 10%, and Debt/Eq < 2x, combined with analyst validation and realistic upside potential.",,258.96,238.25,311.46,8.0,20.27,BUY NOW - At target entry price
LR.PA,LEGRAND,70.5,⭐⭐⭐ EXCELLENT,🟢 Excellent,80.0,70.0,56.0,75.0,65.0,,,,,14.2,False,0,11.4,True,1,"{'eps_growth_yoy': 14.2, 'positive_quarters': 4, 'earnings_accelerating': False, 'eps_accel_quarters': 0, 'profit_margin_pct': 13.2}","{'revenue_growth_yoy': 11.4, 'revenue_accelerating': True, 'rev_accel_quarters': 1}","{'rs_3m': -12.8, 'rs_6m': 2.6}","{'roe_pct': 16.9, 'debt_to_equity': 0.85, 'current_ratio': 1.96, 'operating_margin_pct': 19.1}","{'days_to_earnings': 'N/A', 'recommendation': 'buy', 'analyst_upside_pct': 20.0}",135.6,35545657344,Industrials,Electrical Equipment & Parts,,,False,166.95,-18.8,4,False,162.68,200.0,114.0,19,buy,20.0,99.71,-26.5,67.07,-50.5,3.2,4.34,1.76,45.3,2.38,1.91,True,-0.43,11.6,9.7,9.0,2026-07-29,False,True,6,NEUTRAL,4.64,45.7,1.49,26.9,,,,2026-07-20T07:18:40.698473,CAC40,52.2,3.0,5.0,3.0,3.0,2.5,1.0,0.0,CONFIRMED_UPTREND,BUY,85,"Upside is realistic at 20%, fundamentals are strong with ROE of 16.9%, margin of 13.2%, and debt/equity of 0.85, and analyst validation is present with 19 analysts",,135.5,130.63,175.26,3.59,29.35,BUY NOW - At target entry price
RMV.L,RIGHTMOVE PLC ORD 0.1P,61.0,⭐⭐ GOOD,🟡 Good,60.0,50.0,50.0,100.0,55.0,,,,,,,0,,,0,{'profit_margin_pct': 51.1},{},"{'rs_3m': -5.2, 'rs_6m': -16.7}","{'roe_pct': 266.1, 'debt_to_equity': 0.09, 'current_ratio': 1.89, 'operating_margin_pct': 66.8}","{'days_to_earnings': 'N/A', 'recommendation': 'hold', 'analyst_upside_pct': 22.3}",452.3,3349658112,Communication Services,Internet Content & Information,,,False,827.0,-45.3,1,False,553.24,765.0,404.0,17,hold,22.3,671.0,48.4,470.0,3.9,5.74,0.26,2.36,36.2,0.11,1.52,,,,6.7,11.0,2026-07-31,False,True,6,NEUTRAL,8.56,637.5,0.8,27.9,,,,2026-07-20T07:19:02.258689,FTSE100,54.4,6.0,5.0,0.0,3.0,2.79,1.0,0.0,CONFIRMED_UPTREND,BUY,85,"Strong fundamentals with high ROE and margin, low debt, and analyst validation with a realistic upside","Los datos son mayormente plausibles para Rightmove: es un negocio de plataforma digital con márgenes excepcionales y ROE elevado por recompras agresivas que reducen el patrimonio neto (ROE >200% es conocido en esta empresa). La distancia del -45.3% desde máximos de 52 semanas merece atención —Rightmove cotizó cerca de 800p en 2022 y ha caído significativamente— pero el precio de 452p y target de 553p son coherentes con el rango reciente, por lo que no hay inconsistencia técnica clara; el conjunto es plausible.",445.7,410.05,709.45,8.0,59.18,BUY ON PULLBACK - Wait for 2-5% dip
SGE.L,THE SAGE GROUP PLC ORD 1 4/77P,49.0,⚠️ WEAK,🔴 Weak,55.0,50.0,30.0,50.0,65.0,,,,,,,0,,,0,{'profit_margin_pct': 14.6},{},"{'rs_3m': -11.8, 'rs_6m': -26.0}","{'roe_pct': 75.6, 'debt_to_equity': 9.19, 'current_ratio': 0.62, 'operating_margin_pct': 22.3}","{'days_to_earnings': 'N/A', 'recommendation': 'buy', 'analyst_upside_pct': 25.5}",853.6,7661351936,Technology,Software - Application,,,False,1335.0,-36.1,1,False,1071.0,1334.0,850.0,19,buy,25.5,1651.0,93.4,572.0,-33.0,8.25,0.7,2.65,55.0,0.22,2.1,,,,14.3,122.0,2026-11-19,False,False,6,NEUTRAL,5.77,374.3,1.04,26.8,,,,2026-07-20T07:19:05.579173,FTSE100,65.6,8.0,5.0,0.0,3.0,3.19,3.0,15.0,CONFIRMED_UPTREND,BUY,80,"Strong fundamentals with high ROE and margin, upside potential of 25.5% supported by 19 analysts","El ratio Deuda/Capital de 9.19 es llamativamente alto para una empresa de software como Sage Group, aunque podría reflejar recompras agresivas de acciones que han erosionado el capital contable hasta niveles muy bajos o negativos, lo que distorsiona el ratio. El ROE del 75.6% es consistente con esa misma dinámica (capital contable reducido), por lo que ambos datos son coherentes entre sí aunque extremos; el resto de métricas (margen 14.6%, FCF yield 8.25%, upside 25.5%) son plausibles para Sage Group.",833.2,768.32,1233.42,7.79,48.03,BUY ON PULLBACK - Wait for 2-5% dip
WKL.AS,WOLTERS KLUWER,51.0,⭐ AVERAGE,🟡 Average,60.0,50.0,30.0,50.0,70.0,,,,,,,0,,,0,{'profit_margin_pct': 21.4},{},"{'rs_3m': -11.7, 'rs_6m': -32.0}","{'roe_pct': 111.7, 'debt_to_equity': 6.23, 'current_ratio': 0.65, 'operating_margin_pct': 24.2}","{'days_to_earnings': 'N/A', 'recommendation': 'buy', 'analyst_upside_pct': 47.4}",62.2,13874621440,Industrials,Specialty Business Services,,,False,144.25,-56.9,1,False,91.7,154.0,50.0,15,buy,47.4,187.36,201.2,169.2,172.0,7.1,4.42,4.08,43.1,2.52,1.81,,,,36.9,16.0,2026-08-05,False,True,7,NEUTRAL,9.8,668.9,0.27,30.2,,,,2026-07-20T07:16:48.675645,AEX25,57.4,6.0,8.0,0.0,5.0,5.92,3.0,0.0,CONFIRMED_UPTREND,BUY,80,"Strong fundamentals with high ROE and margin, upside potential of 47.4% supported by 15 analysts, despite high debt/equity ratio","El precio de $62.2 con un máximo de 52 semanas que implica una distancia de -56.9% es muy sospechoso: Wolters Kluwer cotiza habitualmente en el rango de €120-160 en Euronext Ámsterdam, por lo que el precio de $62.2 parece incorrecto o corresponde a un dato mal capturado (posiblemente dividido por 2 o en divisa errónea). El target de $91.7 tampoco cuadra con los precios objetivo reales de los analistas para esta empresa, que suelen superar los €140.",60.86,55.99,108.54,8.0,78.35,BUY NOW - At target entry price
ATCO-B.ST,Atlas Copco AB ser. B,70.4,⭐⭐⭐ EXCELLENT,🟢 Excellent,80.0,60.0,54.5,90.0,70.0,,,,,8.2,True,1,9.1,True,1,"{'eps_growth_yoy': 8.2, 'positive_quarters': 4, 'earnings_accelerating': True, 'eps_accel_quarters': 1, 'profit_margin_pct': 15.7}","{'revenue_growth_yoy': 9.1, 'revenue_accelerating': True, 'rev_accel_quarters': 1}","{'rs_3m': 0.0, 'rs_6m': -1.0}","{'roe_pct': 25.7, 'debt_to_equity': 0.34, 'current_ratio': 1.27, 'operating_margin_pct': 20.6}","{'days_to_earnings': 'N/A', 'recommendation': 'strong_buy', 'analyst_upside_pct': 31.0}",171.75,837903122432,Industrials,Specialty Industrial Machinery,,,False,175.3,-2.0,7,True,225.0,225.0,225.0,1,strong_buy,31.0,302.14,75.9,54.6,-68.2,3.1,16.64,1.73,54.9,3.0,1.62,False,,126.5,4.0,94.0,2026-10-22,False,False,6,NEUTRAL,3.99,53.6,2.92,30.2,,,,2026-07-20T07:18:05.019408,OMXSTO,55.2,3.0,5.0,0.0,1.0,3.88,3.0,0.0,CONFIRMED_UPTREND,BUY,80,"Strong fundamentals with high ROE, decent margin, and manageable debt; upside potential of 31% is realistic",,174.73,160.75,208.61,8.0,19.39,BUY NOW - At target entry price
AMS.MC,"AMADEUS IT GROUP, S.A.",62.0,⭐⭐ GOOD,🟡 Good,65.0,60.0,50.0,70.0,70.0,,,,,-4.1,True,1,3.4,True,1,"{'eps_growth_yoy': -4.1, 'positive_quarters': 4, 'earnings_accelerating': True, 'eps_accel_quarters': 1, 'profit_margin_pct': 20.4}","{'revenue_growth_yoy': 3.4, 'revenue_accelerating': True, 'rev_accel_quarters': 1}","{'rs_3m': -5.0, 'rs_6m': -19.8}","{'roe_pct': 26.0, 'debt_to_equity': 0.7, 'current_ratio': 0.77, 'operating_margin_pct': 28.2}","{'days_to_earnings': 'N/A', 'recommendation': 'buy', 'analyst_upside_pct': 34.7}",49.89,21387194368,Technology,Information Technology Services,,,False,73.6,-32.2,0,False,67.2,80.9,50.0,22,buy,34.7,40.6,-18.6,30.5,-38.9,5.06,2.52,3.08,46.6,1.54,1.73,True,-7.71,21.7,5.1,11.0,2026-07-31,False,True,7,NEUTRAL,7.57,473.7,2.52,26.9,,,,2026-07-20T07:17:45.905284,IBEX35,62.8,6.0,8.0,3.0,3.0,4.34,3.0,0.0,CONFIRMED_UPTREND,BUY,80,"Strong fundamentals with ROE of 26%, margin of 20.4%, and debt/equity of 0.7, combined with a realistic upside of 34.7% and validation from 22 analysts",,49.51,47.57,69.58,3.92,40.54,BUY NOW - At target entry price
EXPN.L,EXPERIAN PLC ORD USD0.10,51.8,⭐ AVERAGE,🟡 Average,55.0,50.0,30.0,65.0,70.0,,,,,,,0,,,0,{'profit_margin_pct': 17.8},{},"{'rs_3m': -10.2, 'rs_6m': -22.4}","{'roe_pct': 28.3, 'debt_to_equity': 1.0, 'current_ratio': 0.85, 'operating_margin_pct': 25.0}","{'days_to_earnings': 'N/A', 'recommendation': 'buy', 'analyst_upside_pct': 35.4}",2760.768,24433846272,Industrials,Consulting Services,,,False,4096.0,-32.6,1,False,3738.89,4694.31,2354.41,17,buy,35.4,3390.0,22.8,2864.0,3.7,3.73,1.03,1.91,39.8,0.52,1.38,,,,23.1,121.0,2026-11-18,False,False,9,STRONG,7.32,646.3,0.7,21.5,,,,2026-07-20T07:18:08.118180,FTSE100,51.7,3.0,5.0,0.0,5.0,4.42,3.0,0.0,CONFIRMED_UPTREND,BUY,80,"Strong fundamentals with ROE of 28.3% and margin of 17.8%, realistic upside of 35.4%, and validation from 17 analysts",,2680.3,2465.88,3880.5,8.0,44.78,BUY ON PULLBACK - Wait for 2-5% dip
AUTO.L,AUTOTRADER GROUP PLC ORD 1P,59.0,⭐ AVERAGE,🟡 Average,60.0,50.0,50.0,90.0,50.0,,,,,,,0,,,0,{'profit_margin_pct': 47.1},{},"{'rs_3m': -7.0, 'rs_6m': -18.2}","{'roe_pct': 60.2, 'debt_to_equity': 0.52, 'current_ratio': 1.73, 'operating_margin_pct': 62.2}","{'days_to_earnings': 'N/A', 'recommendation': 'hold', 'analyst_upside_pct': 12.9}",501.2,3929541632,Communication Services,Internet Content & Information,,,False,844.4,-40.6,1,False,566.0,800.0,410.0,17,hold,12.9,500.0,-0.2,340.0,-32.2,6.2,0.31,2.33,32.0,0.12,0.99,,,,2.0,108.0,2026-11-05,False,False,5,NEUTRAL,9.3,332.4,2.23,21.2,,,,2026-07-20T07:18:11.504086,FTSE100,50.6,6.0,5.0,0.0,1.0,1.61,0.0,0.0,CONFIRMED_UPTREND,BUY,80,"Strong fundamentals with high ROE and margin, moderate debt, and analyst validation with a realistic upside",,492.94,465.89,753.76,5.49,52.91,BUY ON PULLBACK - Wait for 2-5% dip
ASSA-B.ST,ASSA ABLOY AB ser. B,69.0,⭐⭐ GOOD,🟡 Good,90.0,60.0,50.0,70.0,65.0,,,,,15.9,True,1,3.3,True,1,"{'eps_growth_yoy': 15.9, 'positive_quarters': 4, 'earnings_accelerating': True, 'eps_accel_quarters': 1, 'profit_margin_pct': 10.8}","{'revenue_growth_yoy': 3.3, 'revenue_accelerating': True, 'rev_accel_quarters': 1}","{'rs_3m': -12.7, 'rs_6m': -14.6}","{'roe_pct': 15.6, 'debt_to_equity': 0.64, 'current_ratio': 1.01, 'operating_margin_pct': 16.9}","{'days_to_earnings': 'N/A', 'recommendation': 'buy', 'analyst_upside_pct': 18.6}",341.3,379107934208,Industrials,Security & Protection Services,,,False,396.9,-14.0,4,False,404.62,500.0,340.0,21,buy,18.6,436.13,27.8,234.37,-31.3,4.85,17.47,1.84,41.7,6.4,1.69,False,,,15.9,99.0,2026-10-27,False,False,8,STRONG,5.09,118.2,1.4,27.3,,,,2026-07-20T07:17:58.854618,OMXSTO,50.6,3.0,5.0,0.0,5.0,2.33,1.0,0.0,CONFIRMED_UPTREND,BUY,80,"Upside is realistic at 18.6%, fundamentals are strong with ROE of 15.6%, margin of 10.8%, and debt/equity of 0.64, and analyst validation is present with 21 analysts",,335.55,318.21,433.31,5.17,29.13,BUY NOW - At target entry price
RACE.MI,FERRARI,71.6,⭐⭐⭐ EXCELLENT,🟢 Excellent,75.0,70.0,60.5,90.0,60.0,,,,,-2.7,True,2,3.4,True,2,"{'eps_growth_yoy': -2.7, 'positive_quarters': 4, 'earnings_accelerating': True, 'eps_accel_quarters': 2, 'profit_margin_pct': 22.2}","{'revenue_growth_yoy': 3.4, 'revenue_accelerating': True, 'rev_accel_quarters': 2}","{'rs_3m': 1.6, 'rs_6m': 7.9}","{'roe_pct': 42.0, 'debt_to_equity': 0.72, 'current_ratio': 2.57, 'operating_margin_pct': 29.5}","{'days_to_earnings': 'N/A', 'recommendation': 'buy', 'analyst_upside_pct': 14.1}",328.1,57709027328,Consumer Cyclical,Auto Manufacturers,,,False,447.5,-26.7,2,False,374.25,430.0,290.0,19,buy,14.1,82.47,-74.9,89.8,-72.6,1.71,5.6,1.1,33.2,3.62,0.66,True,-1.02,55.0,1.3,9.0,2026-07-30,False,True,9,STRONG,3.56,38.6,23.58,24.8,,,,2026-07-20T07:18:24.859701,FTSEMIB,47.6,0.0,0.0,3.0,1.0,1.76,0.0,0.0,CONFIRMED_UPTREND,BUY,80,"Strong fundamentals with high ROE and margin, reasonable debt, and analyst validation with a realistic upside",,321.59,295.86,444.08,8.0,38.09,BUY ON PULLBACK - Wait for 2-5% dip
HEXA-B.ST,Hexagon AB ser. B,65.5,⭐⭐ GOOD,🟡 Good,100.0,50.0,15.0,90.0,65.0,,,,,750.1,True,1,0.2,False,0,"{'eps_growth_yoy': 750.1, 'positive_quarters': 4, 'earnings_accelerating': True, 'eps_accel_quarters': 1, 'profit_margin_pct': 37.5}","{'revenue_growth_yoy': 0.2, 'revenue_accelerating': False, 'rev_accel_quarters': 0}","{'rs_3m': -27.3, 'rs_6m': -29.9}","{'roe_pct': 17.9, 'debt_to_equity': 0.27, 'current_ratio': 3.44, 'operating_margin_pct': 24.1}","{'days_to_earnings': 'N/A', 'recommendation': 'buy', 'analyst_upside_pct': 16.4}",79.26,212763787264,Technology,Scientific & Technical Instruments,,,False,122.1,-35.1,0,False,92.22,126.66,69.93,14,buy,16.4,,,252.3,218.3,-2.86,-2.36,1.93,18.5,1.52,1.21,True,-0.01,18.9,297.5,9.0,2026-07-29,False,True,6,NEUTRAL,0.44,117.8,0.02,22.0,,,,2026-07-20T07:18:47.236928,OMXSTO,47.2,-5.0,5.0,3.0,5.0,2.05,1.0,0.0,CONFIRMED_UPTREND,BUY,80,"Upside is realistic at 16.4%, fundamentals are strong with ROE of 17.9% and margin of 37.5%, debt to equity is manageable at 0.27, and analyst validation is present with 14 analysts","El margen neto del 37.5% parece excesivamente alto para Hexagon AB, cuya rentabilidad neta real ronda el 15-20%; podría reflejar un dato puntual distorsionado por plusvalías o un error de yfinance. Adicionalmente, el FCF yield negativo (-2.86%) combinado con ese margen neto tan elevado resulta incoherente y refuerza la sospecha de que alguno de los dos datos es incorrecto.",79.07,75.97,114.06,3.92,44.25,BUY NOW - At target entry price
PGHN.SW,PARTNERS GROUP N,52.8,⭐ AVERAGE,🟡 Average,60.0,50.0,15.0,85.0,65.0,,,,,,,0,,,0,{'profit_margin_pct': 49.3},{},"{'rs_3m': -28.7, 'rs_6m': -41.3}","{'roe_pct': 54.8, 'debt_to_equity': 1.14, 'current_ratio': 1.67, 'operating_margin_pct': 60.7}","{'days_to_earnings': 'N/A', 'recommendation': 'buy', 'analyst_upside_pct': 22.3}",680.0,17532532736,Financial Services,Asset Management,,,False,1158.0,-41.3,0,False,831.92,1050.0,680.0,13,buy,22.3,1070.36,57.4,533.17,-21.6,7.67,52.13,6.72,86.7,46.0,3.48,,,,7.7,43.0,2026-09-01,False,False,7,NEUTRAL,7.96,75.9,1.28,31.4,,,,2026-07-20T07:17:23.647543,SMI20,46.1,6.0,0.0,0.0,3.0,2.79,1.0,0.0,CONFIRMED_UPTREND,BUY,80,"Strong fundamentals with high ROE and margin, reasonable debt, and analyst validation with a realistic upside",,671.5,619.75,1004.23,7.71,49.55,BUY NOW - At target entry price
CPG.L,COMPASS GROUP PLC ORD 11 1/20P,57.1,⭐ AVERAGE,🟡 Average,50.0,50.0,74.5,55.0,65.0,,,,,,,0,,,0,{'profit_margin_pct': 4.2},{},"{'rs_3m': 3.4, 'rs_6m': 32.7}","{'roe_pct': 26.9, 'debt_to_equity': 1.13, 'current_ratio': 0.7, 'operating_margin_pct': 6.7}","{'days_to_earnings': 'N/A', 'recommendation': 'buy', 'analyst_upside_pct': 22.1}",31.44,53457850368,Consumer Cyclical,Restaurants,,,False,34.69,-9.4,6,False,38.4,49.05,31.0,20,buy,22.1,29.45,-6.3,19.4,-38.3,3.69,1.16,2.17,55.9,0.69,2.93,,,,16.3,127.0,2026-11-24,False,False,6,NEUTRAL,4.75,100.5,1.18,26.8,,,,2026-07-20T07:17:49.338694,FTSE100,44.8,3.0,5.0,0.0,5.0,2.76,1.0,0.0,CONFIRMED_UPTREND,BUY,80,"Upside potential of 22.1% is realistic, strong fundamentals with ROE of 26.9% and manageable debt, validated by 20 analysts",,30.96,29.74,38.92,3.92,25.71,BUY NOW - At target entry price
DSY.PA,DASSAULT SYSTEMES,59.5,⭐ AVERAGE,🟡 Average,90.0,30.0,30.0,90.0,55.0,,,,,30.9,False,0,-0.8,False,0,"{'eps_growth_yoy': 30.9, 'positive_quarters': 4, 'earnings_accelerating': False, 'eps_accel_quarters': 0, 'profit_margin_pct': 19.9}","{'revenue_growth_yoy': -0.8, 'revenue_accelerating': False, 'rev_accel_quarters': 0}","{'rs_3m': -7.8, 'rs_6m': -29.7}","{'roe_pct': 13.4, 'debt_to_equity': 0.27, 'current_ratio': 1.7, 'operating_margin_pct': 23.4}","{'days_to_earnings': 'N/A', 'recommendation': 'hold', 'analyst_upside_pct': 25.6}",18.13,23822780416,Technology,Software - Application,,,False,33.16,-45.3,0,False,22.77,33.35,13.0,20,hold,25.6,19.52,7.7,9.94,-45.2,5.29,0.96,1.51,28.3,0.27,0.64,True,-0.75,,4.3,3.0,2026-07-23,True,False,8,STRONG,7.08,42.9,1.2,27.3,,,,2026-07-20T07:18:59.494551,CAC40,43.8,6.0,5.0,3.0,1.0,3.2,3.0,0.0,CONFIRMED_UPTREND,BUY,80,"Upside is realistic at 25.6%, fundamentals are strong with ROE of 13.4% and margin of 19.9%, debt to equity is manageable at 0.27, and analyst validation is present with 20 analysts",,17.74,16.56,28.16,6.66,58.69,BUY NOW - At target entry price
ITX.MC,INDUSTRIA DE DISE...O TEXTIL S.,63.0,⭐⭐ GOOD,🟡 Good,70.0,50.0,50.0,90.0,60.0,,,,,5.4,False,0,5.8,False,0,"{'eps_growth_yoy': 5.4, 'positive_quarters': 4, 'earnings_accelerating': False, 'eps_accel_quarters': 0, 'profit_margin_pct': 15.6}","{'revenue_growth_yoy': 5.8, 'revenue_accelerating': False, 'rev_accel_quarters': 0}","{'rs_3m': -2.5, 'rs_6m': -10.0}","{'roe_pct': 34.0, 'debt_to_equity': 0.32, 'current_ratio': 1.29, 'operating_margin_pct': 20.1}","{'days_to_earnings': 'N/A', 'recommendation': 'buy', 'analyst_upside_pct': 10.7}",53.42,166316048384,Consumer Cyclical,Apparel Retail,,,False,58.28,-8.3,5,False,59.14,63.0,41.5,24,buy,10.7,,,20.2,-62.2,,,1.21,57.8,0.65,2.09,,,36.6,5.3,51.0,2026-09-09,False,False,7,NEUTRAL,5.16,37.8,4.23,23.5,,,,2026-07-20T07:18:37.490190,IBEX35,43.2,0.0,0.0,0.0,3.0,1.34,0.0,0.0,CONFIRMED_UPTREND,BUY,80,"Strong fundamentals with high ROE, decent margin, and manageable debt, combined with analyst validation and realistic upside potential",,53.96,51.84,66.04,3.92,22.39,BUY NOW - At target entry price
INDT.ST,Indutrade AB,70.7,⭐⭐⭐ EXCELLENT,🟢 Excellent,85.0,70.0,56.0,70.0,60.0,,,,,22.7,True,1,10.7,True,1,"{'eps_growth_yoy': 22.7, 'positive_quarters': 4, 'earnings_accelerating': True, 'eps_accel_quarters': 1, 'profit_margin_pct': 8.1}","{'revenue_growth_yoy': 10.7, 'revenue_accelerating': True, 'rev_accel_quarters': 1}","{'rs_3m': -7.1, 'rs_6m': 3.1}","{'roe_pct': 15.7, 'debt_to_equity': 0.61, 'current_ratio': 1.49, 'operating_margin_pct': 12.6}","{'days_to_earnings': 'N/A', 'recommendation': 'buy', 'analyst_upside_pct': 10.9}",248.0,90352107520,Industrials,Industrial Distribution,,,False,266.6,-7.0,4,False,275.0,320.0,211.0,8,buy,10.9,261.95,5.6,168.04,-32.2,3.24,8.05,1.25,42.1,3.1,1.08,False,,,22.8,95.0,2026-10-23,False,False,8,STRONG,3.79,33.7,1.21,66.8,,,,2026-07-20T07:18:50.213163,OMXSTO,41.3,3.0,0.0,0.0,5.0,1.36,0.0,0.0,CONFIRMED_UPTREND,BUY,80,"Strong fundamentals with ROE > 10%, margin > 5%, and debt/equity ratio below 1. Upside potential of 10.9% is realistic with validation from 8 analysts.",,242.84,223.42,303.98,8.0,25.18,BUY NOW - At target entry price
MONC.MI,MONCLER,60.5,⭐⭐ GOOD,🟡 Good,60.0,50.0,50.0,90.0,65.0,,,,,,,0,,,0,{'profit_margin_pct': 20.0},{},"{'rs_3m': -11.9, 'rs_6m': -2.7}","{'roe_pct': 16.9, 'debt_to_equity': 0.29, 'current_ratio': 2.42, 'operating_margin_pct': 35.7}","{'days_to_earnings': 'N/A', 'recommendation': 'buy', 'analyst_upside_pct': 21.8}",50.62,13767928832,Consumer Cyclical,Apparel Manufacturing,,,False,59.4,-14.8,3,False,61.65,70.0,49.0,25,buy,21.8,32.97,-34.9,23.1,-54.4,4.43,2.24,2.76,56.3,1.4,1.76,,,,2.0,2.0,2026-07-22,True,False,7,NEUTRAL,6.93,32.2,6.72,21.3,,,,2026-07-20T07:18:43.890191,FTSEMIB,41.2,3.0,5.0,0.0,1.0,2.72,1.0,0.0,CONFIRMED_UPTREND,BUY,80,"Strong fundamentals with ROE > 10%, Margin > 10%, and Debt < 2x, combined with realistic upside and validation from 25 analysts",,50.31,48.33,64.25,3.92,27.72,BUY NOW - At target entry price
RMS.PA,HERMES INTL,57.2,⭐ AVERAGE,🟡 Average,60.0,50.0,30.0,95.0,65.0,,,,,,,0,,,0,{'profit_margin_pct': 28.3},{},"{'rs_3m': -2.7, 'rs_6m': -27.0}","{'roe_pct': 25.2, 'debt_to_equity': 0.12, 'current_ratio': 4.99, 'operating_margin_pct': 41.4}","{'days_to_earnings': 'N/A', 'recommendation': 'buy', 'analyst_upside_pct': 17.1}",1681.5,176119988224,Consumer Cyclical,Luxury Goods,,,False,2421.0,-30.5,1,False,1969.77,2320.0,1500.0,22,buy,17.1,567.5,-66.3,430.3,-74.4,2.29,38.57,1.07,37.2,18.0,0.65,,,,1.3,9.0,2026-07-29,False,True,8,STRONG,4.11,37.5,18.17,34.6,,,,2026-07-20T07:16:45.172143,CAC40,39.9,0.0,0.0,0.0,1.0,2.14,1.0,0.0,CONFIRMED_UPTREND,BUY,80,"Strong fundamentals with high ROE and margin, low debt, and analyst validation with a realistic upside",,1645.91,1532.72,2331.03,6.88,41.63,BUY NOW - At target entry price
OR.PA,L'OREAL,57.9,⭐ AVERAGE,🟡 Average,55.0,50.0,54.5,80.0,60.0,,,,,,,0,,,0,{'profit_margin_pct': 13.9},{},"{'rs_3m': 7.0, 'rs_6m': -7.7}","{'roe_pct': 18.0, 'debt_to_equity': 0.34, 'current_ratio': 1.45, 'operating_margin_pct': 19.2}","{'days_to_earnings': 'N/A', 'recommendation': 'buy', 'analyst_upside_pct': 8.8}",378.75,201646194688,Consumer Defensive,Household & Personal Products,,,False,408.35,-7.2,6,False,412.04,450.0,328.0,24,buy,8.8,163.43,-56.9,114.5,-69.8,2.93,11.11,1.89,61.2,7.2,1.53,,,,0.3,9.0,2026-07-29,False,True,6,NEUTRAL,4.31,69.9,63.81,19.8,,,,2026-07-20T07:16:55.933853,CAC40,38.2,0.0,5.0,0.0,1.0,1.1,0.0,0.0,CONFIRMED_UPTREND,BUY,80,"Strong fundamentals with ROE of 18%, margin of 13.9%, and debt/equity ratio of 0.34, combined with analyst validation and realistic upside of 8.8%",,384.61,362.06,465.62,5.86,21.06,BUY NOW - At target entry price
